log_id,fir_id,event_type,timestamp,officer_id,description
ILOG-00002608,FIR-RBG-2021-00035,OFFICER_ASSIGNED,2021-07-17T07:00:00,OFF-0003772,Officer OFF-0003772 assigned as IO (Current Load: 1 cases)
ILOG-00002617,FIR-BLR-2021-00082,FIR_FILED,2021-07-17T08:00:00,OFF-0000453,FIR KA/BLR/2021/00082 registered at STN-KA-BLR-0048
ILOG-00002559,FIR-KLP-2021-00043,EVIDENCE_COLLECTED,2021-07-17T09:00:00,OFF-0001629,Evidence EVI-00000833 collected: Shop CCTV footage showing accused vehicle
ILOG-00001727,FIR-BLR2-2021-00016,CHARGESHEET,2021-07-17T10:00:00,OFF-0003447,Chargesheet filed against 1 accused
ILOG-00002156,FIR-BLRR-2021-00031,CHARGESHEET,2021-07-17T10:00:00,OFF-0000599,Chargesheet filed against 1 accused
ILOG-00002535,FIR-BLG-2021-00032,EVIDENCE_COLLECTED,2021-07-17T10:00:00,OFF-0001412,Evidence EVI-00000818 collected: CCTV footage from nearby bank ATM showing accused
ILOG-00002536,FIR-BLG-2021-00032,EVIDENCE_COLLECTED,2021-07-17T10:00:00,OFF-0001412,Evidence EVI-00000817 collected: Voluntary statement of witness given
ILOG-00002549,FIR-MGL-2021-00037,EVIDENCE_COLLECTED,2021-07-17T11:00:00,OFF-0001042,Evidence EVI-00000839 collected: DNA analysis report
ILOG-00002516,FIR-KLP-2021-00041,EVIDENCE_COLLECTED,2021-07-17T13:00:00,OFF-0001525,Evidence EVI-00000826 collected: Neighbour's statement recorded
ILOG-00002590,FIR-MGL-2021-00040,EVIDENCE_COLLECTED,2021-07-17T13:00:00,OFF-0001045,Evidence EVI-00000843 collected: Tower location data obtained for accused phone
ILOG-00002606,FIR-MGL-2021-00041,EVIDENCE_COLLECTED,2021-07-17T14:00:00,OFF-0000826,Evidence EVI-00000847 collected: Bank account statement of accused showing proceeds
ILOG-00002505,FIR-RMN-2021-00021,EVIDENCE_COLLECTED,2021-07-17T15:00:00,OFF-0003023,Evidence EVI-00000805 collected: CCTV footage from nearby bank ATM showing accused
ILOG-00002545,FIR-KLP-2021-00042,EVIDENCE_COLLECTED,2021-07-17T15:00:00,OFF-0001624,Evidence EVI-00000837 collected: Statement of auto driver who saw accused
ILOG-00002612,FIR-MGL-2021-00042,FIR_FILED,2021-07-17T17:00:00,,FIR KA/MGL/2021/00042 registered at STN-KA-MGL-0025
ILOG-00002618,FIR-BLR-2021-00082,OFFICER_ASSIGNED,2021-07-17T18:00:00,OFF-0000463,Officer OFF-0000463 assigned as IO (Current Load: 2 cases)
ILOG-00002511,FIR-BLG-2021-00029,ARREST,2021-07-18T06:00:00,OFF-0001296,"Accused Sneha Reddy arrested at Near Railway Station, Belagavi"
ILOG-00002613,FIR-MGL-2021-00042,OFFICER_ASSIGNED,2021-07-18T06:00:00,,Officer None assigned as IO (Current Load: 0 cases)
ILOG-00002541,FIR-MGL-2021-00036,EVIDENCE_COLLECTED,2021-07-18T09:00:00,OFF-0000949,Evidence EVI-00000836 collected: DNA analysis report
ILOG-00002578,FIR-MGL-2021-00035,EVIDENCE_COLLECTED,2021-07-18T10:00:00,OFF-0000948,Evidence EVI-00000831 collected: Hawala transaction records
ILOG-00002322,FIR-RMN-2021-00010,ARREST,2021-07-18T12:00:00,OFF-0002964,"Accused Rekha Adiga arrested at Near Bus Stand, Ramanagara"
ILOG-00002540,FIR-MGL-2021-00036,EVIDENCE_COLLECTED,2021-07-18T12:00:00,OFF-0000949,Evidence EVI-00000835 collected: WhatsApp call records obtained
ILOG-00002570,FIR-BLG-2021-00034,EVIDENCE_COLLECTED,2021-07-18T12:00:00,OFF-0001326,Evidence EVI-00000828 collected: Broken window glass collected from scene
ILOG-00002567,FIR-MGL-2021-00038,EVIDENCE_COLLECTED,2021-07-18T13:00:00,OFF-0001056,Evidence EVI-00000834 collected: Country-made weapon seized
ILOG-00002620,FIR-BLR-2021-00082,EVIDENCE_COLLECTED,2021-07-18T13:00:00,OFF-0000465,Evidence EVI-00000854 collected: Statement of eye witness recorded under Sec 161 CrPC
ILOG-00002562,FIR-BLG-2021-00033,EVIDENCE_COLLECTED,2021-07-18T16:00:00,OFF-0001328,Evidence EVI-00000840 collected: Market CCTV footage retrieved
ILOG-00002518,FIR-KLP-2021-00041,ARREST,2021-07-18T18:00:00,OFF-0001513,"Accused Rekha Adiga arrested at Near Highway, Kalaburagi"
ILOG-00002621,FIR-BLR-2021-00082,EVIDENCE_COLLECTED,2021-07-19T10:00:00,OFF-0000457,Evidence EVI-00000855 collected: Traffic camera footage of escape route
ILOG-00002619,FIR-BLR-2021-00082,EVIDENCE_COLLECTED,2021-07-19T11:00:00,OFF-0000457,Evidence EVI-00000853 collected: Country-made weapon seized
ILOG-00002633,FIR-MGL-2021-00044,EVIDENCE_COLLECTED,2021-07-19T11:00:00,OFF-0000957,Evidence EVI-00000869 collected: Voluntary statement of witness given
ILOG-00002587,FIR-MGL-2021-00040,EVIDENCE_COLLECTED,2021-07-19T14:00:00,OFF-0001044,Evidence EVI-00000845 collected: Chemical analysis of seized narcotic
ILOG-00002588,FIR-MGL-2021-00040,EVIDENCE_COLLECTED,2021-07-19T14:00:00,OFF-0001042,Evidence EVI-00000846 collected: Recovered stolen gold jewellery
ILOG-00002581,FIR-MGL-2021-00035,EVIDENCE_COLLECTED,2021-07-19T15:00:00,OFF-0000946,Evidence EVI-00000832 collected: Recovered stolen gold jewellery
ILOG-00002611,FIR-RBG-2021-00035,EVIDENCE_COLLECTED,2021-07-19T17:00:00,OFF-0003763,Evidence EVI-00000852 collected: Neighbour's statement recorded
ILOG-00002623,FIR-MGL-2021-00043,FIR_FILED,2021-07-19T17:00:00,OFF-0000997,FIR KA/MGL/2021/00043 registered at STN-KA-MGL-0021
ILOG-00002628,FIR-MGL-2021-00044,FIR_FILED,2021-07-19T17:00:00,OFF-0000959,FIR KA/MGL/2021/00044 registered at STN-KA-MGL-0017
ILOG-00002629,FIR-MGL-2021-00044,OFFICER_ASSIGNED,2021-07-19T22:00:00,OFF-0000959,Officer OFF-0000959 assigned as IO (Current Load: 2 cases)
ILOG-00002614,FIR-MGL-2021-00042,EVIDENCE_COLLECTED,2021-07-20T11:00:00,OFF-0001025,Evidence EVI-00000848 collected: Seized iron rod used as weapon
ILOG-00002554,FIR-KLP-2021-00044,EVIDENCE_COLLECTED,2021-07-20T12:00:00,OFF-0001654,Evidence EVI-00000842 collected: Market CCTV footage retrieved
ILOG-00002574,FIR-MGL-2021-00039,EVIDENCE_COLLECTED,2021-07-20T14:00:00,OFF-0000913,Evidence EVI-00000843 collected: Call records linking accused to other suspects
ILOG-00002589,FIR-MGL-2021-00040,EVIDENCE_COLLECTED,2021-07-20T15:00:00,OFF-0001046,Evidence EVI-00000847 collected: Hawala transaction records
ILOG-00002624,FIR-MGL-2021-00043,OFFICER_ASSIGNED,2021-07-20T16:00:00,OFF-0000997,Officer OFF-0000997 assigned as IO (Current Load: 0 cases)
ILOG-00002637,FIR-RBG-2021-00036,EVIDENCE_COLLECTED,2021-07-20T16:00:00,OFF-0003763,Evidence EVI-00000865 collected: GPS tracker data from accused vehicle
ILOG-00002634,FIR-RBG-2021-00036,FIR_FILED,2021-07-20T17:00:00,OFF-0003765,FIR KA/RBG/2021/00036 registered at STN-KA-RBG-0023
ILOG-00002405,FIR-MGL-2021-00033,ARREST,2021-07-20T20:00:00,OFF-0001055,"Accused Sangeetha Murthy arrested at Near Highway, Dakshina Kannada"
ILOG-00002635,FIR-RBG-2021-00036,OFFICER_ASSIGNED,2021-07-21T09:00:00,OFF-0003765,Officer OFF-0003765 assigned as IO (Current Load: 0 cases)
ILOG-00002571,FIR-BLG-2021-00034,EVIDENCE_COLLECTED,2021-07-21T11:00:00,OFF-0001326,Evidence EVI-00000817 collected: Statement of auto driver who saw accused
ILOG-00002579,FIR-MGL-2021-00035,EVIDENCE_COLLECTED,2021-07-21T11:00:00,OFF-0000946,Evidence EVI-00000823 collected: CDR of accused mobile obtained from service provider
ILOG-00002597,FIR-BLG-2021-00035,EVIDENCE_COLLECTED,2021-07-21T11:00:00,OFF-0001328,Evidence EVI-00000828 collected: Seized iron rod used as weapon
ILOG-00002558,FIR-KLP-2021-00043,EVIDENCE_COLLECTED,2021-07-21T12:00:00,OFF-0001628,Evidence EVI-00000837 collected: Statement of eye witness recorded under Sec 161 CrPC
ILOG-00002593,FIR-BLG-2021-00036,EVIDENCE_COLLECTED,2021-07-21T12:00:00,OFF-0001293,Evidence EVI-00000844 collected: Hotel CCTV showing accused check-in
ILOG-00002609,FIR-RBG-2021-00035,EVIDENCE_COLLECTED,2021-07-21T12:00:00,OFF-0003764,Evidence EVI-00000850 collected: Market CCTV footage retrieved
ILOG-00002594,FIR-BLG-2021-00036,EVIDENCE_COLLECTED,2021-07-21T13:00:00,OFF-0001288,Evidence EVI-00000817 collected: Statement of auto driver who saw accused
ILOG-00002644,FIR-VKT-2021-00028,EVIDENCE_COLLECTED,2021-07-21T13:00:00,OFF-0003221,Evidence EVI-00000861 collected: Saliva sample from cigarette butt
ILOG-00002575,FIR-MGL-2021-00039,EVIDENCE_COLLECTED,2021-07-21T14:00:00,OFF-0000910,Evidence EVI-00000839 collected: Chemical analysis of seized narcotic
ILOG-00002598,FIR-BLG-2021-00035,EVIDENCE_COLLECTED,2021-07-21T14:00:00,OFF-0001330,Evidence EVI-00000844 collected: Hotel CCTV showing accused check-in
ILOG-00002632,FIR-MGL-2021-00044,EVIDENCE_COLLECTED,2021-07-21T14:00:00,OFF-0000958,Evidence EVI-00000868 collected: Hawala transaction records
ILOG-00002641,FIR-VKT-2021-00028,FIR_FILED,2021-07-21T14:00:00,,FIR KA/VKT/2021/00028 registered at STN-KA-VKT-0002
ILOG-00002565,FIR-MGL-2021-00038,EVIDENCE_COLLECTED,2021-07-21T16:00:00,OFF-0001058,Evidence EVI-00000841 collected: WhatsApp call records obtained
ILOG-00002642,FIR-VKT-2021-00028,OFFICER_ASSIGNED,2021-07-21T16:00:00,,Officer None assigned as IO (Current Load: 0 cases)
ILOG-00002650,FIR-HBL-2021-00024,FIR_FILED,2021-07-22T09:00:00,,FIR KA/HBL/2021/00024 registered at STN-KA-HBL-0016
ILOG-00002654,FIR-HBL-2021-00024,EVIDENCE_COLLECTED,2021-07-22T09:00:00,OFF-0001175,Evidence EVI-00000879 collected: Country-made weapon seized
ILOG-00002610,FIR-RBG-2021-00035,EVIDENCE_COLLECTED,2021-07-22T12:00:00,OFF-0003761,Evidence EVI-00000851 collected: GPS tracker data from accused vehicle
ILOG-00002636,FIR-RBG-2021-00036,EVIDENCE_COLLECTED,2021-07-22T15:00:00,OFF-0003760,Evidence EVI-00000864 collected: Statement of eye witness recorded under Sec 161 CrPC
ILOG-00002605,FIR-MGL-2021-00041,EVIDENCE_COLLECTED,2021-07-22T17:00:00,OFF-0000827,Evidence EVI-00000849 collected: DNA analysis report
ILOG-00002582,FIR-MGL-2021-00035,SUSPECT_IDENTIFIED,2021-07-23T00:00:00,OFF-0000948,Suspect Sangeetha Murthy identified through investigation
ILOG-00002651,FIR-HBL-2021-00024,OFFICER_ASSIGNED,2021-07-23T04:00:00,OFF-0001175,Officer OFF-0001175 assigned as IO (Current Load: 0 cases)
ILOG-00002656,FIR-KLP-2021-00045,FIR_FILED,2021-07-23T08:00:00,OFF-0001640,FIR KA/KLP/2021/00045 registered at STN-KA-KLP-0024
ILOG-00002665,FIR-HBL-2021-00023,FIR_FILED,2021-07-23T09:00:00,,FIR KA/HBL/2021/00023 registered at STN-KA-HBL-0028
ILOG-00002622,FIR-BLR-2021-00082,EVIDENCE_COLLECTED,2021-07-23T10:00:00,OFF-0000459,Evidence EVI-00000856 collected: Fingerprints lifted from crime scene matched with accused
ILOG-00002631,FIR-MGL-2021-00044,EVIDENCE_COLLECTED,2021-07-23T11:00:00,OFF-0000960,Evidence EVI-00000867 collected: CDR of accused mobile obtained from service provider
ILOG-00002657,FIR-KLP-2021-00045,OFFICER_ASSIGNED,2021-07-23T14:00:00,OFF-0001640,Officer OFF-0001640 assigned as IO (Current Load: 0 cases)
ILOG-00002664,FIR-KLP-2021-00046,EVIDENCE_COLLECTED,2021-07-23T15:00:00,OFF-0001453,Evidence EVI-00000874 collected: Statement of auto driver who saw accused
ILOG-00002646,FIR-VKT-2021-00028,EVIDENCE_COLLECTED,2021-07-23T17:00:00,OFF-0003220,Evidence EVI-00000863 collected: Chemical analysis of seized narcotic
ILOG-00002660,FIR-KLP-2021-00046,FIR_FILED,2021-07-23T17:00:00,,FIR KA/KLP/2021/00046 registered at STN-KA-KLP-0000
ILOG-00002398,FIR-KLP-2021-00035,SUSPECT_IDENTIFIED,2021-07-24T00:00:00,OFF-0001657,Suspect Rekha Adiga identified through investigation
ILOG-00002666,FIR-HBL-2021-00023,OFFICER_ASSIGNED,2021-07-24T04:00:00,,Officer None assigned as IO (Current Load: 0 cases)
ILOG-00002625,FIR-MGL-2021-00043,EVIDENCE_COLLECTED,2021-07-24T09:00:00,OFF-0000995,Evidence EVI-00000857 collected: Hotel CCTV showing accused check-in
ILOG-00002671,FIR-BLR-2021-00083,EVIDENCE_COLLECTED,2021-07-24T09:00:00,OFF-0000061,Evidence EVI-00000882 collected: Shop CCTV footage showing accused vehicle
ILOG-00001892,FIR-MDY-2021-00007,CHARGESHEET,2021-07-24T10:00:00,OFF-0002707,Chargesheet filed against 1 accused
ILOG-00001904,FIR-HSN-2021-00009,CHARGESHEET,2021-07-24T10:00:00,OFF-0002296,Chargesheet filed against 1 accused
ILOG-00002616,FIR-MGL-2021-00042,EVIDENCE_COLLECTED,2021-07-24T10:00:00,OFF-0001025,Evidence EVI-00000843 collected: Tower location data obtained for accused phone
ILOG-00002626,FIR-MGL-2021-00043,EVIDENCE_COLLECTED,2021-07-24T12:00:00,OFF-0001006,Evidence EVI-00000858 collected: Stolen mobile phone recovered from accused
ILOG-00002655,FIR-HBL-2021-00024,EVIDENCE_COLLECTED,2021-07-24T14:00:00,OFF-0001176,Evidence EVI-00000880 collected: Neighbour's statement recorded
ILOG-00002615,FIR-MGL-2021-00042,EVIDENCE_COLLECTED,2021-07-24T15:00:00,OFF-0001024,Evidence EVI-00000847 collected: Bank account statement of accused showing proceeds
ILOG-00002661,FIR-KLP-2021-00046,OFFICER_ASSIGNED,2021-07-24T15:00:00,,Officer None assigned as IO (Current Load: 0 cases)
ILOG-00002674,FIR-CHB-2021-00003,FIR_FILED,2021-07-24T16:00:00,OFF-0002893,FIR KA/CHB/2021/00003 registered at STN-KA-CHB-0005
ILOG-00002630,FIR-MGL-2021-00044,EVIDENCE_COLLECTED,2021-07-24T17:00:00,OFF-0000957,Evidence EVI-00000866 collected: Memory card with crime-related content
ILOG-00002669,FIR-BLR-2021-00083,FIR_FILED,2021-07-24T17:00:00,OFF-0000055,FIR KA/BLR/2021/00083 registered at STN-KA-BLR-0005
ILOG-00002675,FIR-CHB-2021-00003,OFFICER_ASSIGNED,2021-07-24T20:00:00,OFF-0002896,Officer OFF-0002896 assigned as IO (Current Load: 0 cases)
ILOG-00002462,FIR-MGL-2021-00034,SUSPECT_IDENTIFIED,2021-07-25T00:00:00,OFF-0000865,Suspect Sangeetha Murthy identified through investigation
ILOG-00002670,FIR-BLR-2021-00083,OFFICER_ASSIGNED,2021-07-25T01:00:00,OFF-0000059,Officer OFF-0000059 assigned as IO (Current Load: 0 cases)
ILOG-00002685,FIR-BLRR-2021-00046,FIR_FILED,2021-07-25T08:00:00,,FIR KA/BLRR/2021/00046 registered at STN-KA-BLR-R-0009
ILOG-00002659,FIR-KLP-2021-00045,EVIDENCE_COLLECTED,2021-07-25T10:00:00,OFF-0001646,Evidence EVI-00000871 collected: Country-made weapon seized
ILOG-00002627,FIR-MGL-2021-00043,EVIDENCE_COLLECTED,2021-07-25T13:00:00,OFF-0001005,Evidence EVI-00000859 collected: Statement of shop keeper recorded
ILOG-00002643,FIR-VKT-2021-00028,EVIDENCE_COLLECTED,2021-07-25T14:00:00,OFF-0003220,Evidence EVI-00000860 collected: Stolen mobile phone recovered from accused
ILOG-00002686,FIR-BLRR-2021-00046,OFFICER_ASSIGNED,2021-07-25T15:00:00,,Officer None assigned as IO (Current Load: 0 cases)
ILOG-00002690,FIR-BLRR-2021-00046,SUSPECT_IDENTIFIED,2021-07-26T03:00:00,,Suspect Sangeetha Murthy identified through investigation
ILOG-00002399,FIR-KLP-2021-00035,ARREST,2021-07-26T07:00:00,OFF-0001659,"Accused Rekha Adiga arrested at Near Bus Stand, Kalaburagi"
ILOG-00002678,FIR-CHB-2021-00003,EVIDENCE_COLLECTED,2021-07-26T12:00:00,OFF-0002891,Evidence EVI-00000887 collected: Stolen cash recovered from accused
ILOG-00002583,FIR-MGL-2021-00035,ARREST,2021-07-26T14:00:00,OFF-0000947,"Accused Sangeetha Murthy arrested at Near Bus Stand, Dakshina Kannada"
ILOG-00002699,FIR-BLRR-2021-00047,FIR_FILED,2021-07-26T14:00:00,OFF-0000569,FIR KA/BLRR/2021/00047 registered at STN-KA-BLR-R-0001
ILOG-00002692,FIR-BLRR-2021-00045,FIR_FILED,2021-07-26T15:00:00,,FIR KA/BLRR/2021/00045 registered at STN-KA-BLR-R-0014
ILOG-00002696,FIR-BLR2-2021-00019,FIR_FILED,2021-07-26T16:00:00,OFF-0003537,FIR KA/BLR2/2021/00019 registered at STN-KA-BLR2-0024
ILOG-00002662,FIR-KLP-2021-00046,EVIDENCE_COLLECTED,2021-07-26T17:00:00,OFF-0001451,Evidence EVI-00000872 collected: Palm print lifted from window sill
ILOG-00002700,FIR-BLRR-2021-00047,OFFICER_ASSIGNED,2021-07-26T17:00:00,OFF-0000569,Officer OFF-0000569 assigned as IO (Current Load: 3 cases)
ILOG-00002431,FIR-RMN-2021-00017,SUSPECT_IDENTIFIED,2021-07-27T00:00:00,,Suspect Rekha Adiga identified through investigation
ILOG-00002697,FIR-BLR2-2021-00019,OFFICER_ASSIGNED,2021-07-27T05:00:00,OFF-0003543,Officer OFF-0003543 assigned as IO (Current Load: 1 cases)
ILOG-00002702,FIR-BLRR-2021-00047,EVIDENCE_COLLECTED,2021-07-27T09:00:00,OFF-0000568,Evidence EVI-00000889 collected: Blood group analysis report
ILOG-00001808,FIR-MGL-2021-00020,CHARGESHEET,2021-07-27T10:00:00,OFF-0000899,Chargesheet filed against 1 accused
ILOG-00002645,FIR-VKT-2021-00028,EVIDENCE_COLLECTED,2021-07-27T11:00:00,OFF-0003221,Evidence EVI-00000862 collected: Statement of shop keeper recorded
ILOG-00002693,FIR-BLRR-2021-00045,OFFICER_ASSIGNED,2021-07-27T12:00:00,,Officer None assigned as IO (Current Load: 0 cases)
ILOG-00002691,FIR-BLRR-2021-00046,ARREST,2021-07-27T13:00:00,OFF-0000616,"Accused Sangeetha Murthy arrested at Near Market, Bengaluru Rural"
ILOG-00002712,FIR-BLR-2021-00084,FIR_FILED,2021-07-27T13:00:00,,FIR KA/BLR/2021/00084 registered at STN-KA-BLR-0056
ILOG-00002653,FIR-HBL-2021-00024,EVIDENCE_COLLECTED,2021-07-27T14:00:00,OFF-0001172,Evidence EVI-00000878 collected: Traffic camera footage of escape route
ILOG-00002463,FIR-MGL-2021-00034,ARREST,2021-07-27T15:00:00,OFF-0000854,"Accused Sangeetha Murthy arrested at Near Railway Station, Dakshina Kannada"
ILOG-00002707,FIR-CKM-2021-00001,FIR_FILED,2021-07-27T15:00:00,,FIR KA/CKM/2021/00001 registered at STN-KA-CKM-0004
ILOG-00002714,FIR-BLR-2021-00084,EVIDENCE_COLLECTED,2021-07-27T15:00:00,OFF-0000542,Evidence EVI-00000894 collected: Market CCTV footage retrieved
ILOG-00002713,FIR-BLR-2021-00084,OFFICER_ASSIGNED,2021-07-28T07:00:00,OFF-0000538,Officer OFF-0000538 assigned as IO (Current Load: 1 cases)
ILOG-00002718,FIR-BLRR-2021-00048,FIR_FILED,2021-07-28T09:00:00,OFF-0000593,FIR KA/BLRR/2021/00048 registered at STN-KA-BLR-R-0005
ILOG-00002719,FIR-BLRR-2021-00048,OFFICER_ASSIGNED,2021-07-28T10:00:00,OFF-0000593,Officer OFF-0000593 assigned as IO (Current Load: 2 cases)
ILOG-00002721,FIR-BLRR-2021-00048,EVIDENCE_COLLECTED,2021-07-28T10:00:00,OFF-0000592,Evidence EVI-00000895 collected: DNA analysis report
ILOG-00002708,FIR-CKM-2021-00001,OFFICER_ASSIGNED,2021-07-28T11:00:00,,Officer None assigned as IO (Current Load: 0 cases)
ILOG-00002715,FIR-BLRR-2021-00044,FIR_FILED,2021-07-28T13:00:00,OFF-0000593,FIR KA/BLRR/2021/00044 registered at STN-KA-BLR-R-0005
ILOG-00002652,FIR-HBL-2021-00024,EVIDENCE_COLLECTED,2021-07-28T14:00:00,OFF-0001170,Evidence EVI-00000877 collected: Palm print lifted from window sill
ILOG-00002676,FIR-CHB-2021-00003,EVIDENCE_COLLECTED,2021-07-28T14:00:00,OFF-0002897,Evidence EVI-00000885 collected: Fingerprint report from KFSL
ILOG-00002677,FIR-CHB-2021-00003,EVIDENCE_COLLECTED,2021-07-28T16:00:00,OFF-0002894,Evidence EVI-00000886 collected: CDR of accused mobile obtained from service provider
ILOG-00002720,FIR-BLRR-2021-00048,EVIDENCE_COLLECTED,2021-07-28T16:00:00,OFF-0000591,Evidence EVI-00000881 collected: Tower location data obtained for accused phone
ILOG-00002442,FIR-KLP-2021-00038,SUSPECT_IDENTIFIED,2021-07-29T00:00:00,OFF-0001553,Suspect Rekha Adiga identified through investigation
ILOG-00002716,FIR-BLRR-2021-00044,OFFICER_ASSIGNED,2021-07-29T07:00:00,OFF-0000593,Officer OFF-0000593 assigned as IO (Current Load: 1 cases)
ILOG-00002689,FIR-BLRR-2021-00046,EVIDENCE_COLLECTED,2021-07-29T11:00:00,OFF-0000617,Evidence EVI-00000884 collected: Stolen two-wheeler recovered
ILOG-00002663,FIR-KLP-2021-00046,EVIDENCE_COLLECTED,2021-07-29T15:00:00,OFF-0001451,Evidence EVI-00000873 collected: Hotel CCTV showing accused check-in
ILOG-00002658,FIR-KLP-2021-00045,EVIDENCE_COLLECTED,2021-07-29T16:00:00,OFF-0001640,Evidence EVI-00000870 collected: Traffic camera footage of escape route
ILOG-00002667,FIR-HBL-2021-00023,EVIDENCE_COLLECTED,2021-07-29T17:00:00,OFF-0001252,Evidence EVI-00000875 collected: CCTV footage from nearby bank ATM showing accused
ILOG-00002668,FIR-HBL-2021-00023,EVIDENCE_COLLECTED,2021-07-30T12:00:00,OFF-0001251,Evidence EVI-00000876 collected: Voluntary statement of witness given
ILOG-00002717,FIR-BLRR-2021-00044,EVIDENCE_COLLECTED,2021-07-30T12:00:00,OFF-0000595,Evidence EVI-00000881 collected: CDR of accused mobile obtained from service provider
ILOG-00002723,FIR-BLRR-2021-00049,FIR_FILED,2021-07-30T17:00:00,OFF-0000601,FIR KA/BLRR/2021/00049 registered at STN-KA-BLR-R-0007
ILOG-00002443,FIR-KLP-2021-00038,ARREST,2021-07-31T06:00:00,OFF-0001551,"Accused Rekha Adiga arrested at Near Highway, Kalaburagi"
ILOG-00002724,FIR-BLRR-2021-00049,OFFICER_ASSIGNED,2021-07-31T06:00:00,OFF-0000601,Officer OFF-0000601 assigned as IO (Current Load: 1 cases)
ILOG-00002698,FIR-BLR2-2021-00019,EVIDENCE_COLLECTED,2021-07-31T09:00:00,OFF-0003533,Evidence EVI-00000890 collected: Fingerprints lifted from crime scene matched with accused
ILOG-00002432,FIR-RMN-2021-00017,ARREST,2021-07-31T11:00:00,OFF-0003041,"Accused Rekha Adiga arrested at Near Bus Stand, Ramanagara"
ILOG-00002679,FIR-CHB-2021-00003,EVIDENCE_COLLECTED,2021-07-31T13:00:00,OFF-0002890,Evidence EVI-00000888 collected: Voluntary statement of witness given
ILOG-00002729,FIR-RBG-2021-00037,FIR_FILED,2021-07-31T13:00:00,OFF-0003759,FIR KA/RBG/2021/00037 registered at STN-KA-RBG-0022
ILOG-00002701,FIR-BLRR-2021-00047,EVIDENCE_COLLECTED,2021-07-31T14:00:00,OFF-0000568,Evidence EVI-00000881 collected: CDR of accused mobile obtained from service provider
ILOG-00002711,FIR-CKM-2021-00001,EVIDENCE_COLLECTED,2021-07-31T14:00:00,OFF-0002379,Evidence EVI-00000893 collected: Country-made weapon seized
ILOG-00002709,FIR-CKM-2021-00001,EVIDENCE_COLLECTED,2021-07-31T17:00:00,OFF-0002380,Evidence EVI-00000891 collected: Shop CCTV footage showing accused vehicle
ILOG-00002726,FIR-BLRR-2021-00049,SUSPECT_IDENTIFIED,2021-07-31T18:00:00,OFF-0000601,Suspect Sangeetha Murthy identified through investigation
ILOG-00002730,FIR-RBG-2021-00037,OFFICER_ASSIGNED,2021-08-01T06:00:00,OFF-0003759,Officer OFF-0003759 assigned as IO (Current Load: 0 cases)
ILOG-00002732,FIR-RBG-2021-00037,EVIDENCE_COLLECTED,2021-08-01T09:00:00,OFF-0003758,Evidence EVI-00000903 collected: Voluntary statement of witness given
ILOG-00001833,FIR-MDY-2021-00003,CHARGESHEET,2021-08-01T10:00:00,OFF-0002733,Chargesheet filed against 1 accused
ILOG-00002149,FIR-RBG-2021-00034,CHARGESHEET,2021-08-01T10:00:00,OFF-0003764,Chargesheet filed against 1 accused
ILOG-00002725,FIR-BLRR-2021-00049,EVIDENCE_COLLECTED,2021-08-01T10:00:00,OFF-0000607,Evidence EVI-00000896 collected: Hawala transaction records
ILOG-00002688,FIR-BLRR-2021-00046,EVIDENCE_COLLECTED,2021-08-01T11:00:00,OFF-0000615,Evidence EVI-00000889 collected: Tool mark examination report
ILOG-00002694,FIR-BLRR-2021-00045,EVIDENCE_COLLECTED,2021-08-01T11:00:00,OFF-0000636,Evidence EVI-00000883 collected: Hawala transaction records
ILOG-00002740,FIR-VKT-2021-00029,EVIDENCE_COLLECTED,2021-08-01T11:00:00,OFF-0003245,Evidence EVI-00000905 collected: Statement of eye witness recorded under Sec 161 CrPC
ILOG-00002695,FIR-BLRR-2021-00045,EVIDENCE_COLLECTED,2021-08-01T12:00:00,OFF-0000637,Evidence EVI-00000884 collected: Seized iron rod used as weapon
ILOG-00002738,FIR-VKT-2021-00029,FIR_FILED,2021-08-01T12:00:00,,FIR KA/VKT/2021/00029 registered at STN-KA-VKT-0008
ILOG-00002703,FIR-BLRR-2021-00047,EVIDENCE_COLLECTED,2021-08-01T13:00:00,OFF-0000567,Evidence EVI-00000883 collected: ATM withdrawal records from crime location
ILOG-00002727,FIR-BLRR-2021-00049,ARREST,2021-08-01T13:00:00,OFF-0000602,"Accused Sangeetha Murthy arrested at Near Railway Station, Bengaluru Rural"
ILOG-00002687,FIR-BLRR-2021-00046,EVIDENCE_COLLECTED,2021-08-01T15:00:00,OFF-0000615,Evidence EVI-00000881 collected: Call records linking accused to other suspects
ILOG-00002731,FIR-RBG-2021-00037,EVIDENCE_COLLECTED,2021-08-01T15:00:00,OFF-0003759,Evidence EVI-00000902 collected: Recovered stolen gold jewellery
ILOG-00002734,FIR-BLRR-2021-00050,FIR_FILED,2021-08-01T19:00:00,,FIR KA/BLRR/2021/00050 registered at STN-KA-BLR-R-0008
ILOG-00002735,FIR-BLRR-2021-00050,OFFICER_ASSIGNED,2021-08-02T02:00:00,,Officer None assigned as IO (Current Load: 0 cases)
ILOG-00002739,FIR-VKT-2021-00029,OFFICER_ASSIGNED,2021-08-02T08:00:00,OFF-0003248,Officer OFF-0003248 assigned as IO (Current Load: 2 cases)
ILOG-00002704,FIR-BLRR-2021-00047,EVIDENCE_COLLECTED,2021-08-02T09:00:00,OFF-0000568,Evidence EVI-00000884 collected: Seized iron rod used as weapon
ILOG-00002722,FIR-BLRR-2021-00048,EVIDENCE_COLLECTED,2021-08-02T09:00:00,OFF-0000591,Evidence EVI-00000896 collected: Hawala transaction records
ILOG-00002742,FIR-RBG-2021-00038,FIR_FILED,2021-08-02T15:00:00,OFF-0003765,FIR KA/RBG/2021/00038 registered at STN-KA-RBG-0023
ILOG-00002744,FIR-RBG-2021-00038,EVIDENCE_COLLECTED,2021-08-02T16:00:00,OFF-0003760,Evidence EVI-00000907 collected: Traffic camera footage of escape route
ILOG-00002710,FIR-CKM-2021-00001,EVIDENCE_COLLECTED,2021-08-02T17:00:00,OFF-0002377,Evidence EVI-00000892 collected: Statement of auto driver who saw accused
ILOG-00002743,FIR-RBG-2021-00038,OFFICER_ASSIGNED,2021-08-02T21:00:00,OFF-0003772,Officer OFF-0003772 assigned as IO (Current Load: 2 cases)
ILOG-00002638,FIR-RBG-2021-00036,SUSPECT_IDENTIFIED,2021-08-03T00:00:00,OFF-0003765,Suspect Anil Lingayat identified through investigation
ILOG-00002759,FIR-BLRR-2021-00052,EVIDENCE_COLLECTED,2021-08-03T10:00:00,OFF-0000609,Evidence EVI-00000895 collected: Blood group analysis report
ILOG-00002749,FIR-BLR-2021-00085,EVIDENCE_COLLECTED,2021-08-03T11:00:00,OFF-0000092,Evidence EVI-00000897 collected: Neighbour's statement recorded
ILOG-00002737,FIR-BLRR-2021-00050,EVIDENCE_COLLECTED,2021-08-03T12:00:00,OFF-0000611,Evidence EVI-00000896 collected: ATM withdrawal records from crime location
ILOG-00002755,FIR-BLRR-2021-00052,FIR_FILED,2021-08-03T14:00:00,,FIR KA/BLRR/2021/00052 registered at STN-KA-BLR-R-0008
ILOG-00002733,FIR-RBG-2021-00037,EVIDENCE_COLLECTED,2021-08-03T15:00:00,OFF-0003758,Evidence EVI-00000904 collected: Tool mark examination report
ILOG-00002747,FIR-BLR-2021-00085,FIR_FILED,2021-08-03T15:00:00,,FIR KA/BLR/2021/00085 registered at STN-KA-BLR-0008
ILOG-00002751,FIR-HBL-2021-00025,FIR_FILED,2021-08-03T15:00:00,,FIR KA/HBL/2021/00025 registered at STN-KA-HBL-0013
ILOG-00002550,FIR-MGL-2021-00037,SUSPECT_IDENTIFIED,2021-08-04T00:00:00,OFF-0001044,Suspect Sangeetha Murthy identified through investigation
ILOG-00002748,FIR-BLR-2021-00085,OFFICER_ASSIGNED,2021-08-04T00:00:00,,Officer None assigned as IO (Current Load: 0 cases)
ILOG-00002756,FIR-BLRR-2021-00052,OFFICER_ASSIGNED,2021-08-04T06:00:00,,Officer None assigned as IO (Current Load: 0 cases)
ILOG-00002741,FIR-VKT-2021-00029,EVIDENCE_COLLECTED,2021-08-04T11:00:00,OFF-0003247,Evidence EVI-00000906 collected: Blood group analysis report
