log_id,fir_id,event_type,timestamp,officer_id,description
ILOG-00003694,FIR-MGL-2021-00057,FIR_FILED,2021-10-17T17:00:00,,FIR KA/MGL/2021/00057 registered at STN-KA-MGL-0011
ILOG-00003386,FIR-RBG-2021-00047,SUSPECT_IDENTIFIED,2021-10-18T00:00:00,OFF-0003629,Suspect Yogesh Lingayat identified through investigation
ILOG-00003692,FIR-KLP-2021-00075,OFFICER_ASSIGNED,2021-10-18T04:00:00,OFF-0001671,Officer OFF-0001671 assigned as IO (Current Load: 3 cases)
ILOG-00003695,FIR-MGL-2021-00057,OFFICER_ASSIGNED,2021-10-18T07:00:00,,Officer None assigned as IO (Current Load: 0 cases)
ILOG-00003223,FIR-RBG-2021-00044,CHARGESHEET,2021-10-18T10:00:00,OFF-0003795,Chargesheet filed against 1 accused
ILOG-00003707,FIR-KLP-2021-00073,FIR_FILED,2021-10-18T10:00:00,OFF-0001633,FIR KA/KLP/2021/00073 registered at STN-KA-KLP-0023
ILOG-00003678,FIR-BLR-2021-00120,EVIDENCE_COLLECTED,2021-10-18T11:00:00,OFF-0000264,Evidence EVI-00001304 collected: Seized iron rod used as weapon
ILOG-00003625,FIR-BLG-2021-00055,EVIDENCE_COLLECTED,2021-10-18T13:00:00,OFF-0001430,Evidence EVI-00001291 collected: Market CCTV footage retrieved
ILOG-00003637,FIR-BLR-2021-00115,EVIDENCE_COLLECTED,2021-10-18T13:00:00,OFF-0000080,Evidence EVI-00001262 collected: Stolen mobile phone recovered from accused
ILOG-00003619,FIR-KLP-2021-00069,EVIDENCE_COLLECTED,2021-10-18T14:00:00,OFF-0001645,Evidence EVI-00001250 collected: Bank account statement of accused showing proceeds
ILOG-00003714,FIR-KLP-2021-00074,EVIDENCE_COLLECTED,2021-10-18T14:00:00,OFF-0001586,Evidence EVI-00001308 collected: Country-made weapon seized
ILOG-00003711,FIR-KLP-2021-00074,FIR_FILED,2021-10-18T15:00:00,OFF-0001585,FIR KA/KLP/2021/00074 registered at STN-KA-KLP-0017
ILOG-00003717,FIR-KLP-2021-00076,FIR_FILED,2021-10-18T15:00:00,OFF-0001597,FIR KA/KLP/2021/00076 registered at STN-KA-KLP-0020
ILOG-00003719,FIR-KLP-2021-00076,EVIDENCE_COLLECTED,2021-10-18T15:00:00,OFF-0001604,Evidence EVI-00001318 collected: CDR of accused mobile obtained from service provider
ILOG-00003592,FIR-BLR-2021-00116,EVIDENCE_COLLECTED,2021-10-18T16:00:00,OFF-0000050,Evidence EVI-00001273 collected: Statement of shop keeper recorded
ILOG-00003698,FIR-MGL-2021-00057,EVIDENCE_COLLECTED,2021-10-18T16:00:00,OFF-0000912,Evidence EVI-00001315 collected: Voluntary statement of witness given
ILOG-00003728,FIR-BLG-2021-00058,EVIDENCE_COLLECTED,2021-10-18T16:00:00,OFF-0001450,Evidence EVI-00001321 collected: Statement of shop keeper recorded
ILOG-00003724,FIR-BLG-2021-00058,FIR_FILED,2021-10-18T17:00:00,OFF-0001439,FIR KA/BLG/2021/00058 registered at STN-KA-BLG-0029
ILOG-00003631,FIR-BLR-2021-00119,ARREST,2021-10-18T18:00:00,OFF-0000390,"Accused Pooja Sharma arrested at Near Bus Stand, Bengaluru Urban"
ILOG-00003729,FIR-HBL-2021-00034,FIR_FILED,2021-10-18T18:00:00,,FIR KA/HBL/2021/00034 registered at STN-KA-HBL-0014
ILOG-00003701,FIR-KLP-2021-00071,FIR_FILED,2021-10-18T19:00:00,OFF-0001696,FIR KA/KLP/2021/00071 registered at STN-KA-KLP-0029
ILOG-00003712,FIR-KLP-2021-00074,OFFICER_ASSIGNED,2021-10-18T20:00:00,OFF-0001585,Officer OFF-0001585 assigned as IO (Current Load: 1 cases)
ILOG-00003620,FIR-KLP-2021-00069,SUSPECT_IDENTIFIED,2021-10-19T00:00:00,OFF-0001640,Suspect Sangeetha Murthy identified through investigation
ILOG-00003702,FIR-KLP-2021-00071,OFFICER_ASSIGNED,2021-10-19T00:00:00,OFF-0001689,Officer OFF-0001689 assigned as IO (Current Load: 0 cases)
ILOG-00003730,FIR-HBL-2021-00034,OFFICER_ASSIGNED,2021-10-19T01:00:00,,Officer None assigned as IO (Current Load: 0 cases)
ILOG-00003718,FIR-KLP-2021-00076,OFFICER_ASSIGNED,2021-10-19T05:00:00,OFF-0001602,Officer OFF-0001602 assigned as IO (Current Load: 1 cases)
ILOG-00003607,FIR-BLR-2021-00117,EVIDENCE_COLLECTED,2021-10-19T09:00:00,OFF-0000071,Evidence EVI-00001286 collected: FASTag records showing vehicle movement
ILOG-00003708,FIR-KLP-2021-00073,OFFICER_ASSIGNED,2021-10-19T09:00:00,OFF-0001636,Officer OFF-0001636 assigned as IO (Current Load: 0 cases)
ILOG-00003727,FIR-BLG-2021-00058,EVIDENCE_COLLECTED,2021-10-19T09:00:00,OFF-0001450,Evidence EVI-00001320 collected: Country-made weapon seized
ILOG-00003726,FIR-BLG-2021-00058,EVIDENCE_COLLECTED,2021-10-19T10:00:00,OFF-0001442,Evidence EVI-00001319 collected: Hotel CCTV showing accused check-in
ILOG-00003735,FIR-MYS-2021-00022,FIR_FILED,2021-10-19T13:00:00,,FIR KA/MYS/2021/00022 registered at STN-KA-MYS-0020
ILOG-00003705,FIR-KLP-2021-00071,EVIDENCE_COLLECTED,2021-10-19T15:00:00,OFF-0001691,Evidence EVI-00001302 collected: Tower location data obtained for accused phone
ILOG-00003725,FIR-BLG-2021-00058,OFFICER_ASSIGNED,2021-10-19T16:00:00,OFF-0001446,Officer OFF-0001446 assigned as IO (Current Load: 0 cases)
ILOG-00003312,FIR-BLR-2021-00106,ARREST,2021-10-19T19:00:00,OFF-0000390,"Accused Yogesh Kamath arrested at Near Highway, Bengaluru Urban"
ILOG-00003736,FIR-MYS-2021-00022,OFFICER_ASSIGNED,2021-10-19T21:00:00,OFF-0000769,Officer OFF-0000769 assigned as IO (Current Load: 1 cases)
ILOG-00003521,FIR-HVR-2021-00002,SUSPECT_IDENTIFIED,2021-10-20T00:00:00,OFF-0003119,Suspect Tejas Reddy identified through investigation
ILOG-00003608,FIR-BLR-2021-00117,SUSPECT_IDENTIFIED,2021-10-20T00:00:00,OFF-0000074,Suspect Shruthi Gowda identified through investigation
ILOG-00003732,FIR-HBL-2021-00034,SUSPECT_IDENTIFIED,2021-10-20T00:00:00,,Suspect Yogesh Thakur identified through investigation
ILOG-00003739,FIR-UDR-2021-00053,FIR_FILED,2021-10-20T08:00:00,OFF-0002561,FIR KA/UDR/2021/00053 registered at STN-KA-UDR-0015
ILOG-00003636,FIR-BLR-2021-00115,EVIDENCE_COLLECTED,2021-10-20T09:00:00,OFF-0000079,Evidence EVI-00001261 collected: Voluntary statement of witness given
ILOG-00003693,FIR-KLP-2021-00075,EVIDENCE_COLLECTED,2021-10-20T09:00:00,OFF-0001670,Evidence EVI-00001312 collected: Statement of auto driver who saw accused
ILOG-00003209,FIR-BLG-2021-00041,CHARGESHEET,2021-10-20T10:00:00,OFF-0001291,Chargesheet filed against 1 accused
ILOG-00003700,FIR-MGL-2021-00057,EVIDENCE_COLLECTED,2021-10-20T10:00:00,OFF-0000913,Evidence EVI-00001317 collected: Latent fingerprints developed using powder technique
ILOG-00003651,FIR-BLG-2021-00057,EVIDENCE_COLLECTED,2021-10-20T11:00:00,OFF-0001410,Evidence EVI-00001294 collected: Traffic camera footage of escape route
ILOG-00003744,FIR-BDR-2021-00004,FIR_FILED,2021-10-20T11:00:00,OFF-0002053,FIR KA/BDR/2021/00004 registered at STN-KA-BDR-0002
ILOG-00003745,FIR-BDR-2021-00004,OFFICER_ASSIGNED,2021-10-20T12:00:00,OFF-0002053,Officer OFF-0002053 assigned as IO (Current Load: 0 cases)
ILOG-00003642,FIR-RBG-2021-00053,EVIDENCE_COLLECTED,2021-10-20T15:00:00,OFF-0003648,Evidence EVI-00001280 collected: Statement of shop keeper recorded
ILOG-00003715,FIR-KLP-2021-00074,EVIDENCE_COLLECTED,2021-10-20T15:00:00,OFF-0001584,Evidence EVI-00001302 collected: CDR of accused mobile obtained from service provider
ILOG-00003737,FIR-MYS-2021-00022,EVIDENCE_COLLECTED,2021-10-20T15:00:00,OFF-0000769,Evidence EVI-00001323 collected: FASTag records showing vehicle movement
ILOG-00003747,FIR-BDR-2021-00004,EVIDENCE_COLLECTED,2021-10-20T15:00:00,OFF-0002054,Evidence EVI-00001336 collected: Voluntary statement of witness given
ILOG-00003687,FIR-MGL-2021-00056,EVIDENCE_COLLECTED,2021-10-20T16:00:00,OFF-0001025,Evidence EVI-00001307 collected: Stolen mobile phone recovered from accused
ILOG-00003635,FIR-BLR-2021-00115,EVIDENCE_COLLECTED,2021-10-20T17:00:00,OFF-0000072,Evidence EVI-00001260 collected: Recovered vehicle from accused's possession
ILOG-00003703,FIR-KLP-2021-00071,EVIDENCE_COLLECTED,2021-10-20T17:00:00,OFF-0001694,Evidence EVI-00001250 collected: Bank account statement of accused showing proceeds
ILOG-00003740,FIR-UDR-2021-00053,OFFICER_ASSIGNED,2021-10-21T00:00:00,OFF-0002562,Officer OFF-0002562 assigned as IO (Current Load: 0 cases)
ILOG-00003522,FIR-HVR-2021-00002,ARREST,2021-10-21T10:00:00,OFF-0003121,"Accused Tejas Reddy arrested at Near Bus Stand, Haveri"
ILOG-00003684,FIR-UDR-2021-00052,EVIDENCE_COLLECTED,2021-10-21T13:00:00,OFF-0002479,Evidence EVI-00001301 collected: Statement of auto driver who saw accused
ILOG-00003759,FIR-RBG-2021-00054,FIR_FILED,2021-10-21T13:00:00,OFF-0003691,FIR KA/RBG/2021/00054 registered at STN-KA-RBG-0014
ILOG-00003641,FIR-RBG-2021-00053,EVIDENCE_COLLECTED,2021-10-21T14:00:00,OFF-0003649,Evidence EVI-00001279 collected: Seized iron rod used as weapon
ILOG-00003757,FIR-MYS-2021-00023,EVIDENCE_COLLECTED,2021-10-21T14:00:00,OFF-0000676,Evidence EVI-00001331 collected: Statement of eye witness recorded under Sec 161 CrPC
ILOG-00003762,FIR-RBG-2021-00054,EVIDENCE_COLLECTED,2021-10-21T15:00:00,OFF-0003701,Evidence EVI-00001334 collected: Stolen cash recovered from accused
ILOG-00003742,FIR-UDR-2021-00053,EVIDENCE_COLLECTED,2021-10-21T16:00:00,OFF-0002561,Evidence EVI-00001326 collected: Shop CCTV footage showing accused vehicle
ILOG-00003387,FIR-RBG-2021-00047,ARREST,2021-10-21T18:00:00,OFF-0003635,"Accused Yogesh Lingayat arrested at Near Highway, Dharwad"
ILOG-00003748,FIR-HBL-2021-00035,FIR_FILED,2021-10-21T18:00:00,,FIR KA/HBL/2021/00035 registered at STN-KA-HBL-0006
ILOG-00003609,FIR-BLR-2021-00117,ARREST,2021-10-21T19:00:00,OFF-0000069,"Accused Shruthi Gowda arrested at Near Bus Stand, Bengaluru Urban"
ILOG-00003755,FIR-MYS-2021-00023,FIR_FILED,2021-10-21T19:00:00,,FIR KA/MYS/2021/00023 registered at STN-KA-MYS-0004
ILOG-00003749,FIR-HBL-2021-00035,OFFICER_ASSIGNED,2021-10-22T04:00:00,OFF-0001109,Officer OFF-0001109 assigned as IO (Current Load: 2 cases)
ILOG-00003756,FIR-MYS-2021-00023,OFFICER_ASSIGNED,2021-10-22T09:00:00,,Officer None assigned as IO (Current Load: 0 cases)
ILOG-00003766,FIR-MGL-2021-00058,FIR_FILED,2021-10-22T09:00:00,OFF-0000971,FIR KA/MGL/2021/00058 registered at STN-KA-MGL-0019
ILOG-00003710,FIR-KLP-2021-00073,EVIDENCE_COLLECTED,2021-10-22T10:00:00,OFF-0001627,Evidence EVI-00001311 collected: Traffic camera footage of escape route
ILOG-00003731,FIR-HBL-2021-00034,EVIDENCE_COLLECTED,2021-10-22T10:00:00,OFF-0001160,Evidence EVI-00001322 collected: Stolen two-wheeler recovered
ILOG-00003760,FIR-RBG-2021-00054,OFFICER_ASSIGNED,2021-10-22T10:00:00,OFF-0003691,Officer OFF-0003691 assigned as IO (Current Load: 0 cases)
ILOG-00003699,FIR-MGL-2021-00057,EVIDENCE_COLLECTED,2021-10-22T12:00:00,OFF-0000911,Evidence EVI-00001316 collected: Stolen mobile phone recovered from accused
ILOG-00003773,FIR-BLR-2021-00122,FIR_FILED,2021-10-22T12:00:00,OFF-0000358,FIR KA/BLR/2021/00122 registered at STN-KA-BLR-0038
ILOG-00003763,FIR-MYS-2021-00024,FIR_FILED,2021-10-22T13:00:00,OFF-0000680,FIR KA/MYS/2021/00024 registered at STN-KA-MYS-0005
ILOG-00003746,FIR-BDR-2021-00004,EVIDENCE_COLLECTED,2021-10-22T15:00:00,OFF-0002054,Evidence EVI-00001335 collected: FASTag records showing vehicle movement
ILOG-00003761,FIR-RBG-2021-00054,EVIDENCE_COLLECTED,2021-10-22T15:00:00,OFF-0003696,Evidence EVI-00001333 collected: Stolen mobile phone recovered from accused
ILOG-00003664,FIR-HSN-2021-00010,EVIDENCE_COLLECTED,2021-10-22T16:00:00,OFF-0002280,Evidence EVI-00001282 collected: Stolen two-wheeler recovered
ILOG-00003679,FIR-BLR-2021-00120,EVIDENCE_COLLECTED,2021-10-22T16:00:00,OFF-0000269,Evidence EVI-00001305 collected: Saliva sample from cigarette butt
ILOG-00003768,FIR-MGL-2021-00058,EVIDENCE_COLLECTED,2021-10-22T17:00:00,OFF-0000981,Evidence EVI-00001338 collected: Statement of eye witness recorded under Sec 161 CrPC
ILOG-00003767,FIR-MGL-2021-00058,OFFICER_ASSIGNED,2021-10-22T21:00:00,OFF-0000977,Officer OFF-0000977 assigned as IO (Current Load: 0 cases)
ILOG-00003380,FIR-BLG-2021-00048,SUSPECT_IDENTIFIED,2021-10-23T00:00:00,,Suspect Sangeetha Murthy identified through investigation
ILOG-00003753,FIR-HBL-2021-00035,SUSPECT_IDENTIFIED,2021-10-23T00:00:00,OFF-0001109,Suspect Raghavendra Kumar identified through investigation
ILOG-00003764,FIR-MYS-2021-00024,OFFICER_ASSIGNED,2021-10-23T00:00:00,OFF-0000682,Officer OFF-0000682 assigned as IO (Current Load: 0 cases)
ILOG-00003774,FIR-BLR-2021-00122,OFFICER_ASSIGNED,2021-10-23T00:00:00,OFF-0000358,Officer OFF-0000358 assigned as IO (Current Load: 0 cases)
ILOG-00003704,FIR-KLP-2021-00071,EVIDENCE_COLLECTED,2021-10-23T09:00:00,OFF-0001690,Evidence EVI-00001303 collected: Tool mark examination report
ILOG-00003709,FIR-KLP-2021-00073,EVIDENCE_COLLECTED,2021-10-23T10:00:00,OFF-0001627,Evidence EVI-00001310 collected: Statement of auto driver who saw accused
ILOG-00003696,FIR-MGL-2021-00057,EVIDENCE_COLLECTED,2021-10-23T11:00:00,OFF-0000912,Evidence EVI-00001313 collected: Hotel CCTV showing accused check-in
ILOG-00003770,FIR-MGL-2021-00058,EVIDENCE_COLLECTED,2021-10-23T11:00:00,OFF-0000980,Evidence EVI-00001340 collected: CCTV footage from nearby bank ATM showing accused
ILOG-00003781,FIR-MYS-2021-00026,FIR_FILED,2021-10-23T11:00:00,,FIR KA/MYS/2021/00026 registered at STN-KA-MYS-0018
ILOG-00003713,FIR-KLP-2021-00074,EVIDENCE_COLLECTED,2021-10-23T13:00:00,OFF-0001585,Evidence EVI-00001303 collected: Ballistic report on firearm
ILOG-00003776,FIR-SHV-2021-00005,FIR_FILED,2021-10-23T14:00:00,OFF-0001838,FIR KA/SHV/2021/00005 registered at STN-KA-SHV-0012
ILOG-00003750,FIR-HBL-2021-00035,EVIDENCE_COLLECTED,2021-10-23T15:00:00,OFF-0001109,Evidence EVI-00001328 collected: Memory card with crime-related content
ILOG-00003697,FIR-MGL-2021-00057,EVIDENCE_COLLECTED,2021-10-23T16:00:00,OFF-0000912,Evidence EVI-00001314 collected: Chemical analysis of seized narcotic
ILOG-00003741,FIR-UDR-2021-00053,EVIDENCE_COLLECTED,2021-10-23T17:00:00,OFF-0002557,Evidence EVI-00001325 collected: Statement of eye witness recorded under Sec 161 CrPC
ILOG-00003621,FIR-KLP-2021-00069,ARREST,2021-10-23T20:00:00,OFF-0001649,"Accused Sangeetha Murthy arrested at Near Highway, Kalaburagi"
ILOG-00003771,FIR-MGL-2021-00058,SUSPECT_IDENTIFIED,2021-10-24T00:00:00,OFF-0000977,Suspect Nagaraj Sharma identified through investigation
ILOG-00003777,FIR-SHV-2021-00005,OFFICER_ASSIGNED,2021-10-24T04:00:00,OFF-0001838,Officer OFF-0001838 assigned as IO (Current Load: 1 cases)
ILOG-00003720,FIR-KLP-2021-00076,EVIDENCE_COLLECTED,2021-10-24T09:00:00,OFF-0001598,Evidence EVI-00001308 collected: Stolen two-wheeler recovered
ILOG-00003782,FIR-MYS-2021-00026,OFFICER_ASSIGNED,2021-10-24T09:00:00,,Officer None assigned as IO (Current Load: 0 cases)
ILOG-00003778,FIR-SHV-2021-00005,EVIDENCE_COLLECTED,2021-10-24T11:00:00,OFF-0001838,Evidence EVI-00001341 collected: Neighbour's statement recorded
ILOG-00003785,FIR-HBL-2021-00036,FIR_FILED,2021-10-24T11:00:00,OFF-0001144,FIR KA/HBL/2021/00036 registered at STN-KA-HBL-0011
ILOG-00003733,FIR-HBL-2021-00034,ARREST,2021-10-24T13:00:00,OFF-0001161,"Accused Yogesh Thakur arrested at Near Highway, Hubballi-Dharwad"
ILOG-00003706,FIR-KLP-2021-00071,EVIDENCE_COLLECTED,2021-10-24T14:00:00,OFF-0001695,Evidence EVI-00001308 collected: Stolen mobile phone recovered from accused
ILOG-00003716,FIR-KLP-2021-00074,EVIDENCE_COLLECTED,2021-10-24T16:00:00,OFF-0001584,Evidence EVI-00001250 collected: UPI transaction records showing fund transfer
ILOG-00003673,FIR-KLP-2021-00070,SUSPECT_IDENTIFIED,2021-10-25T00:00:00,OFF-0001527,Suspect Sangeetha Murthy identified through investigation
ILOG-00003786,FIR-HBL-2021-00036,OFFICER_ASSIGNED,2021-10-25T04:00:00,OFF-0001144,Officer OFF-0001144 assigned as IO (Current Load: 1 cases)
ILOG-00003772,FIR-MGL-2021-00058,ARREST,2021-10-25T08:00:00,OFF-0000980,"Accused Nagaraj Sharma arrested at Near Railway Station, Dakshina Kannada"
ILOG-00003799,FIR-MGL-2021-00059,FIR_FILED,2021-10-25T09:00:00,OFF-0000956,FIR KA/MGL/2021/00059 registered at STN-KA-MGL-0016
ILOG-00003738,FIR-MYS-2021-00022,EVIDENCE_COLLECTED,2021-10-25T10:00:00,OFF-0000768,Evidence EVI-00001324 collected: CCTV footage from nearby bank ATM showing accused
ILOG-00003743,FIR-UDR-2021-00053,EVIDENCE_COLLECTED,2021-10-25T10:00:00,OFF-0002560,Evidence EVI-00001327 collected: Country-made weapon seized
ILOG-00003758,FIR-MYS-2021-00023,EVIDENCE_COLLECTED,2021-10-25T11:00:00,OFF-0000678,Evidence EVI-00001332 collected: Hotel CCTV showing accused check-in
ILOG-00003775,FIR-BLR-2021-00122,EVIDENCE_COLLECTED,2021-10-25T11:00:00,OFF-0000360,Evidence EVI-00001347 collected: Stolen jewellery identified and recovered
ILOG-00003801,FIR-MGL-2021-00059,EVIDENCE_COLLECTED,2021-10-25T13:00:00,OFF-0000950,Evidence EVI-00001349 collected: Stolen jewellery identified and recovered
ILOG-00003788,FIR-HBL-2021-00036,EVIDENCE_COLLECTED,2021-10-25T14:00:00,OFF-0001148,Evidence EVI-00001352 collected: Ballistic report on firearm
ILOG-00003815,FIR-MYS-2021-00028,FIR_FILED,2021-10-25T14:00:00,OFF-0000770,FIR KA/MYS/2021/00028 registered at STN-KA-MYS-0021
ILOG-00003820,FIR-MYS-2021-00028,EVIDENCE_COLLECTED,2021-10-25T14:00:00,OFF-0000773,Evidence EVI-00001362 collected: Statement of shop keeper recorded
ILOG-00003751,FIR-HBL-2021-00035,EVIDENCE_COLLECTED,2021-10-25T15:00:00,OFF-0001108,Evidence EVI-00001329 collected: ATM withdrawal records from crime location
ILOG-00003800,FIR-MGL-2021-00059,OFFICER_ASSIGNED,2021-10-25T15:00:00,OFF-0000956,Officer OFF-0000956 assigned as IO (Current Load: 2 cases)
ILOG-00003792,FIR-MYS-2021-00025,FIR_FILED,2021-10-25T16:00:00,OFF-0000675,FIR KA/MYS/2021/00025 registered at STN-KA-MYS-0003
ILOG-00003814,FIR-BLR-2021-00123,EVIDENCE_COLLECTED,2021-10-25T16:00:00,OFF-0000039,Evidence EVI-00001356 collected: Recovered stolen gold jewellery
ILOG-00003806,FIR-MYS-2021-00027,FIR_FILED,2021-10-25T17:00:00,,FIR KA/MYS/2021/00027 registered at STN-KA-MYS-0007
ILOG-00003810,FIR-BLR-2021-00123,FIR_FILED,2021-10-25T18:00:00,OFF-0000038,FIR KA/BLR/2021/00123 registered at STN-KA-BLR-0004
ILOG-00003807,FIR-MYS-2021-00027,OFFICER_ASSIGNED,2021-10-26T00:00:00,,Officer None assigned as IO (Current Load: 0 cases)
ILOG-00003811,FIR-BLR-2021-00123,OFFICER_ASSIGNED,2021-10-26T01:00:00,OFF-0000041,Officer OFF-0000041 assigned as IO (Current Load: 0 cases)
ILOG-00003816,FIR-MYS-2021-00028,OFFICER_ASSIGNED,2021-10-26T01:00:00,OFF-0000770,Officer OFF-0000770 assigned as IO (Current Load: 0 cases)
ILOG-00003793,FIR-MYS-2021-00025,OFFICER_ASSIGNED,2021-10-26T06:00:00,OFF-0000675,Officer OFF-0000675 assigned as IO (Current Load: 1 cases)
ILOG-00003824,FIR-MYS-2021-00029,FIR_FILED,2021-10-26T09:00:00,OFF-0000680,FIR KA/MYS/2021/00029 registered at STN-KA-MYS-0005
ILOG-00002728,FIR-BLRR-2021-00049,CHARGESHEET,2021-10-26T10:00:00,OFF-0000602,Chargesheet filed against 1 accused
ILOG-00002876,FIR-BLRR-2021-00053,CHARGESHEET,2021-10-26T10:00:00,OFF-0000623,Chargesheet filed against 1 accused
ILOG-00003821,FIR-UDR-2021-00054,FIR_FILED,2021-10-26T10:00:00,,FIR KA/UDR/2021/00054 registered at STN-KA-UDR-0013
ILOG-00003381,FIR-BLG-2021-00048,ARREST,2021-10-26T11:00:00,OFF-0001312,"Accused Sangeetha Murthy arrested at Near Bus Stand, Belagavi"
ILOG-00003830,FIR-BLR-2021-00124,EVIDENCE_COLLECTED,2021-10-26T11:00:00,OFF-0000130,Evidence EVI-00001369 collected: Shop CCTV footage showing accused vehicle
ILOG-00003752,FIR-HBL-2021-00035,EVIDENCE_COLLECTED,2021-10-26T13:00:00,OFF-0001106,Evidence EVI-00001330 collected: Call records linking accused to other suspects
ILOG-00003828,FIR-BLR-2021-00124,FIR_FILED,2021-10-26T14:00:00,OFF-0000127,FIR KA/BLR/2021/00124 registered at STN-KA-BLR-0012
ILOG-00003836,FIR-KLP-2021-00078,FIR_FILED,2021-10-26T14:00:00,OFF-0001666,FIR KA/KLP/2021/00078 registered at STN-KA-KLP-0026
ILOG-00003779,FIR-SHV-2021-00005,EVIDENCE_COLLECTED,2021-10-26T15:00:00,OFF-0001838,Evidence EVI-00001342 collected: Shop CCTV footage showing accused vehicle
ILOG-00003780,FIR-SHV-2021-00005,EVIDENCE_COLLECTED,2021-10-26T16:00:00,OFF-0001840,Evidence EVI-00001343 collected: Seized iron rod used as weapon
ILOG-00003832,FIR-BLR-2021-00124,EVIDENCE_COLLECTED,2021-10-26T17:00:00,OFF-0000125,Evidence EVI-00001371 collected: Statement of eye witness recorded under Sec 161 CrPC
ILOG-00003829,FIR-BLR-2021-00124,OFFICER_ASSIGNED,2021-10-26T18:00:00,OFF-0000128,Officer OFF-0000128 assigned as IO (Current Load: 1 cases)
ILOG-00003822,FIR-UDR-2021-00054,OFFICER_ASSIGNED,2021-10-26T21:00:00,,Officer None assigned as IO (Current Load: 0 cases)
ILOG-00003825,FIR-MYS-2021-00029,OFFICER_ASSIGNED,2021-10-27T01:00:00,OFF-0000684,Officer OFF-0000684 assigned as IO (Current Load: 0 cases)
ILOG-00003769,FIR-MGL-2021-00058,EVIDENCE_COLLECTED,2021-10-27T09:00:00,OFF-0000970,Evidence EVI-00001339 collected: Country-made weapon seized
ILOG-00003784,FIR-MYS-2021-00026,EVIDENCE_COLLECTED,2021-10-27T09:00:00,OFF-0000755,Evidence EVI-00001348 collected: Palm print lifted from window sill
ILOG-00003837,FIR-KLP-2021-00078,OFFICER_ASSIGNED,2021-10-27T10:00:00,OFF-0001666,Officer OFF-0001666 assigned as IO (Current Load: 0 cases)
ILOG-00003845,FIR-CTV-2021-00011,FIR_FILED,2021-10-27T10:00:00,OFF-0003327,FIR KA/CTV/2021/00011 registered at STN-KA-CTV-0006
ILOG-00003854,FIR-KLP-2021-00077,EVIDENCE_COLLECTED,2021-10-27T10:00:00,OFF-0001502,Evidence EVI-00001365 collected: Hotel CCTV showing accused check-in
ILOG-00003856,FIR-HBL-2021-00038,FIR_FILED,2021-10-27T10:00:00,,FIR KA/HBL/2021/00038 registered at STN-KA-HBL-0014
ILOG-00003765,FIR-MYS-2021-00024,EVIDENCE_COLLECTED,2021-10-27T11:00:00,OFF-0000680,Evidence EVI-00001337 collected: Stolen two-wheeler recovered
ILOG-00003674,FIR-KLP-2021-00070,ARREST,2021-10-27T12:00:00,OFF-0001524,"Accused Sangeetha Murthy arrested at Near Railway Station, Kalaburagi"
ILOG-00003850,FIR-KLP-2021-00077,FIR_FILED,2021-10-27T12:00:00,OFF-0001506,FIR KA/KLP/2021/00077 registered at STN-KA-KLP-0008
ILOG-00003802,FIR-MGL-2021-00059,EVIDENCE_COLLECTED,2021-10-27T14:00:00,OFF-0000950,Evidence EVI-00001350 collected: Voluntary statement of witness given
ILOG-00003851,FIR-KLP-2021-00077,OFFICER_ASSIGNED,2021-10-27T14:00:00,OFF-0001504,Officer OFF-0001504 assigned as IO (Current Load: 1 cases)
ILOG-00003839,FIR-BLR-2021-00121,FIR_FILED,2021-10-27T15:00:00,OFF-0000011,FIR KA/BLR/2021/00121 registered at STN-KA-BLR-0000
ILOG-00003754,FIR-HBL-2021-00035,ARREST,2021-10-27T18:00:00,OFF-0001109,"Accused Raghavendra Kumar arrested at Near Bus Stand, Hubballi-Dharwad"
ILOG-00003474,FIR-BLG-2021-00051,SUSPECT_IDENTIFIED,2021-10-28T00:00:00,OFF-0001364,Suspect Nagaraj Lingayat identified through investigation
ILOG-00003857,FIR-HBL-2021-00038,OFFICER_ASSIGNED,2021-10-28T03:00:00,,Officer None assigned as IO (Current Load: 0 cases)
ILOG-00003868,FIR-MDY-2021-00011,FIR_FILED,2021-10-28T08:00:00,OFF-0002694,FIR KA/MDY/2021/00011 registered at STN-KA-MDY-0007
ILOG-00003846,FIR-CTV-2021-00011,OFFICER_ASSIGNED,2021-10-28T09:00:00,OFF-0003327,Officer OFF-0003327 assigned as IO (Current Load: 0 cases)
ILOG-00003320,FIR-UDR-2021-00047,CHARGESHEET,2021-10-28T10:00:00,OFF-0002628,Chargesheet filed against 1 accused
ILOG-00003823,FIR-UDR-2021-00054,EVIDENCE_COLLECTED,2021-10-28T11:00:00,OFF-0002541,Evidence EVI-00001367 collected: Latent fingerprints developed using powder technique
ILOG-00003840,FIR-BLR-2021-00121,OFFICER_ASSIGNED,2021-10-28T11:00:00,OFF-0000010,Officer OFF-0000010 assigned as IO (Current Load: 0 cases)
ILOG-00003864,FIR-HBL-2021-00037,FIR_FILED,2021-10-28T12:00:00,OFF-0001207,FIR KA/HBL/2021/00037 registered at STN-KA-HBL-0021
ILOG-00003783,FIR-MYS-2021-00026,EVIDENCE_COLLECTED,2021-10-28T13:00:00,OFF-0000753,Evidence EVI-00001344 collected: Hotel CCTV showing accused check-in
ILOG-00003858,FIR-HBL-2021-00038,EVIDENCE_COLLECTED,2021-10-28T13:00:00,OFF-0001161,Evidence EVI-00001376 collected: Country-made weapon seized
ILOG-00003869,FIR-MDY-2021-00011,OFFICER_ASSIGNED,2021-10-28T14:00:00,OFF-0002694,Officer OFF-0002694 assigned as IO (Current Load: 0 cases)
ILOG-00003817,FIR-MYS-2021-00028,EVIDENCE_COLLECTED,2021-10-28T15:00:00,OFF-0000772,Evidence EVI-00001360 collected: Shop CCTV footage showing accused vehicle
ILOG-00003813,FIR-BLR-2021-00123,EVIDENCE_COLLECTED,2021-10-28T17:00:00,OFF-0000048,Evidence EVI-00001355 collected: Statement of shop keeper recorded
ILOG-00003859,FIR-MYS-2021-00030,FIR_FILED,2021-10-28T19:00:00,OFF-0000776,FIR KA/MYS/2021/00030 registered at STN-KA-MYS-0022
ILOG-00003833,FIR-BLR-2021-00124,SUSPECT_IDENTIFIED,2021-10-29T00:00:00,OFF-0000128,Suspect Akash Singh identified through investigation
ILOG-00003865,FIR-HBL-2021-00037,OFFICER_ASSIGNED,2021-10-29T01:00:00,OFF-0001207,Officer OFF-0001207 assigned as IO (Current Load: 1 cases)
ILOG-00003860,FIR-MYS-2021-00030,OFFICER_ASSIGNED,2021-10-29T06:00:00,OFF-0000785,Officer OFF-0000785 assigned as IO (Current Load: 1 cases)
ILOG-00003787,FIR-HBL-2021-00036,EVIDENCE_COLLECTED,2021-10-29T11:00:00,OFF-0001144,Evidence EVI-00001351 collected: Voluntary statement of witness given
ILOG-00003877,FIR-MYS-2021-00031,EVIDENCE_COLLECTED,2021-10-29T12:00:00,OFF-0000722,Evidence EVI-00001361 collected: Blood group analysis report
ILOG-00003867,FIR-HBL-2021-00037,EVIDENCE_COLLECTED,2021-10-29T16:00:00,OFF-0001202,Evidence EVI-00001375 collected: Hotel CCTV showing accused check-in
ILOG-00003875,FIR-MYS-2021-00031,FIR_FILED,2021-10-29T16:00:00,OFF-0000722,FIR KA/MYS/2021/00031 registered at STN-KA-MYS-0013
ILOG-00003876,FIR-MYS-2021-00031,OFFICER_ASSIGNED,2021-10-29T21:00:00,OFF-0000722,Officer OFF-0000722 assigned as IO (Current Load: 0 cases)
ILOG-00003803,FIR-MGL-2021-00059,SUSPECT_IDENTIFIED,2021-10-30T00:00:00,OFF-0000956,Suspect Nirmala Murthy identified through investigation
ILOG-00003826,FIR-MYS-2021-00029,EVIDENCE_COLLECTED,2021-10-30T09:00:00,OFF-0000682,Evidence EVI-00001362 collected: Neighbour's statement recorded
ILOG-00003848,FIR-CTV-2021-00011,EVIDENCE_COLLECTED,2021-10-30T09:00:00,OFF-0003327,Evidence EVI-00001358 collected: Recovered vehicle from accused's possession
ILOG-00003819,FIR-MYS-2021-00028,EVIDENCE_COLLECTED,2021-10-30T10:00:00,OFF-0000773,Evidence EVI-00001353 collected: Fingerprints lifted from crime scene matched with accused
ILOG-00003871,FIR-MDY-2021-00011,EVIDENCE_COLLECTED,2021-10-30T10:00:00,OFF-0002693,Evidence EVI-00001379 collected: Stolen two-wheeler recovered
ILOG-00003884,FIR-BLR-2021-00125,FIR_FILED,2021-10-30T10:00:00,OFF-0000393,FIR KA/BLR/2021/00125 registered at STN-KA-BLR-0040
