log_id,fir_id,event_type,timestamp,officer_id,description
ILOG-00001323,FIR-BLR-2021-00053,OFFICER_ASSIGNED,2021-04-06T21:00:00,OFF-0000147,Officer OFF-0000147 assigned as IO (Current Load: 0 cases)
ILOG-00001060,FIR-BLR-2021-00048,SUSPECT_IDENTIFIED,2021-04-07T00:00:00,,Suspect Basavaraj Pillai identified through investigation
ILOG-00001336,FIR-BLR-2021-00054,OFFICER_ASSIGNED,2021-04-07T01:00:00,,Officer None assigned as IO (Current Load: 0 cases)
ILOG-00001231,FIR-MGL-2021-00015,EVIDENCE_COLLECTED,2021-04-07T09:00:00,OFF-0000895,Evidence EVI-00000426 collected: Shop CCTV footage showing accused vehicle
ILOG-00001327,FIR-BLR-2021-00053,SUSPECT_IDENTIFIED,2021-04-07T09:00:00,OFF-0000147,Suspect Sangeetha Murthy identified through investigation
ILOG-00001234,FIR-TKR-2021-00003,EVIDENCE_COLLECTED,2021-04-07T10:00:00,OFF-0001868,Evidence EVI-00000427 collected: Neighbour's statement recorded
ILOG-00001284,FIR-CTV-2021-00001,EVIDENCE_COLLECTED,2021-04-07T11:00:00,OFF-0003327,Evidence EVI-00000448 collected: Market CCTV footage retrieved
ILOG-00001238,FIR-MYS-2021-00006,EVIDENCE_COLLECTED,2021-04-07T13:00:00,OFF-0000689,Evidence EVI-00000415 collected: Hawala transaction records
ILOG-00001253,FIR-MYS-2021-00004,EVIDENCE_COLLECTED,2021-04-07T15:00:00,OFF-0000779,Evidence EVI-00000416 collected: Tower location data obtained for accused phone
ILOG-00001279,FIR-MYS-2021-00009,EVIDENCE_COLLECTED,2021-04-07T15:00:00,OFF-0000742,Evidence EVI-00000436 collected: WhatsApp call records obtained
ILOG-00001342,FIR-MYS-2021-00013,FIR_FILED,2021-04-07T15:00:00,OFF-0000809,FIR KA/MYS/2021/00013 registered at STN-KA-MYS-0027
ILOG-00001274,FIR-BLR2-2021-00010,EVIDENCE_COLLECTED,2021-04-07T16:00:00,OFF-0003537,Evidence EVI-00000440 collected: Statement of eye witness recorded under Sec 161 CrPC
ILOG-00001313,FIR-BLR-2021-00052,EVIDENCE_COLLECTED,2021-04-07T16:00:00,OFF-0000404,Evidence EVI-00000450 collected: Recovered stolen gold jewellery
ILOG-00001348,FIR-CTV-2021-00005,FIR_FILED,2021-04-07T18:00:00,OFF-0003341,FIR KA/CTV/2021/00005 registered at STN-KA-CTV-0009
ILOG-00000920,FIR-MYS-2021-00002,ARREST,2021-04-07T21:00:00,OFF-0000696,"Accused Anil Naik arrested at Near Bus Stand, Mysuru"
ILOG-00001220,FIR-MYS-2021-00005,SUSPECT_IDENTIFIED,2021-04-08T00:00:00,OFF-0000769,Suspect Rohit Sharma identified through investigation
ILOG-00001247,FIR-HSN-2021-00002,SUSPECT_IDENTIFIED,2021-04-08T00:00:00,OFF-0002335,Suspect Ramesh Shastri identified through investigation
ILOG-00001349,FIR-CTV-2021-00005,OFFICER_ASSIGNED,2021-04-08T00:00:00,OFF-0003341,Officer OFF-0003341 assigned as IO (Current Load: 0 cases)
ILOG-00001343,FIR-MYS-2021-00013,OFFICER_ASSIGNED,2021-04-08T06:00:00,OFF-0000809,Officer OFF-0000809 assigned as IO (Current Load: 0 cases)
ILOG-00001338,FIR-BLR-2021-00054,EVIDENCE_COLLECTED,2021-04-08T10:00:00,OFF-0000173,Evidence EVI-00000453 collected: Neighbour's statement recorded
ILOG-00001351,FIR-BLR-2021-00055,FIR_FILED,2021-04-08T10:00:00,,FIR KA/BLR/2021/00055 registered at STN-KA-BLR-0002
ILOG-00001359,FIR-MYS-2021-00014,EVIDENCE_COLLECTED,2021-04-08T10:00:00,OFF-0000697,Evidence EVI-00000465 collected: ATM withdrawal records from crime location
ILOG-00001363,FIR-CTV-2021-00006,FIR_FILED,2021-04-08T10:00:00,,FIR KA/CTV/2021/00006 registered at STN-KA-CTV-0014
ILOG-00001303,FIR-CTV-2021-00002,EVIDENCE_COLLECTED,2021-04-08T12:00:00,OFF-0003317,Evidence EVI-00000451 collected: FASTag records showing vehicle movement
ILOG-00001354,FIR-BLR-2021-00055,EVIDENCE_COLLECTED,2021-04-08T12:00:00,OFF-0000018,Evidence EVI-00000463 collected: Stolen two-wheeler recovered
ILOG-00001324,FIR-BLR-2021-00053,EVIDENCE_COLLECTED,2021-04-08T13:00:00,OFF-0000142,Evidence EVI-00000453 collected: Statement of auto driver who saw accused
ILOG-00001245,FIR-HSN-2021-00002,EVIDENCE_COLLECTED,2021-04-08T14:00:00,OFF-0002334,Evidence EVI-00000407 collected: Stolen jewellery identified and recovered
ILOG-00001272,FIR-BLR2-2021-00010,EVIDENCE_COLLECTED,2021-04-08T14:00:00,OFF-0003544,Evidence EVI-00000438 collected: Palm print lifted from window sill
ILOG-00001357,FIR-MYS-2021-00014,FIR_FILED,2021-04-08T15:00:00,OFF-0000697,FIR KA/MYS/2021/00014 registered at STN-KA-MYS-0008
ILOG-00001314,FIR-BLR-2021-00052,EVIDENCE_COLLECTED,2021-04-08T17:00:00,OFF-0000406,Evidence EVI-00000442 collected: Market CCTV footage retrieved
ILOG-00001366,FIR-CTV-2021-00006,EVIDENCE_COLLECTED,2021-04-08T17:00:00,OFF-0003372,Evidence EVI-00000468 collected: Stolen jewellery identified and recovered
ILOG-00001358,FIR-MYS-2021-00014,OFFICER_ASSIGNED,2021-04-08T18:00:00,OFF-0000697,Officer OFF-0000697 assigned as IO (Current Load: 0 cases)
ILOG-00000992,FIR-KLP-2021-00025,ARREST,2021-04-08T20:00:00,OFF-0001692,"Accused Priya Hegde arrested at Near Market, Kalaburagi"
ILOG-00001361,FIR-MYS-2021-00014,SUSPECT_IDENTIFIED,2021-04-09T06:00:00,OFF-0000697,Suspect Rohit Sharma identified through investigation
ILOG-00001352,FIR-BLR-2021-00055,OFFICER_ASSIGNED,2021-04-09T07:00:00,,Officer None assigned as IO (Current Load: 0 cases)
ILOG-00001364,FIR-CTV-2021-00006,OFFICER_ASSIGNED,2021-04-09T07:00:00,,Officer None assigned as IO (Current Load: 0 cases)
ILOG-00001380,FIR-CTV-2021-00007,FIR_FILED,2021-04-09T10:00:00,,FIR KA/CTV/2021/00007 registered at STN-KA-CTV-0014
ILOG-00001263,FIR-RCR-2021-00002,EVIDENCE_COLLECTED,2021-04-09T11:00:00,OFF-0001978,Evidence EVI-00000432 collected: Broken window glass collected from scene
ILOG-00001367,FIR-CTV-2021-00006,EVIDENCE_COLLECTED,2021-04-09T11:00:00,OFF-0003371,Evidence EVI-00000448 collected: Shop CCTV footage showing accused vehicle
ILOG-00001375,FIR-MYS-2021-00015,FIR_FILED,2021-04-09T11:00:00,OFF-0000662,FIR KA/MYS/2021/00015 registered at STN-KA-MYS-0001
ILOG-00001384,FIR-CTV-2021-00007,EVIDENCE_COLLECTED,2021-04-09T12:00:00,OFF-0003373,Evidence EVI-00000473 collected: Toll plaza records with vehicle photograph
ILOG-00001350,FIR-CTV-2021-00005,EVIDENCE_COLLECTED,2021-04-09T14:00:00,OFF-0003341,Evidence EVI-00000464 collected: Recovered vehicle from accused's possession
ILOG-00001221,FIR-MYS-2021-00005,ARREST,2021-04-09T15:00:00,OFF-0000767,"Accused Rohit Sharma arrested at Near Bus Stand, Mysuru"
ILOG-00001376,FIR-MYS-2021-00015,OFFICER_ASSIGNED,2021-04-09T16:00:00,OFF-0000662,Officer OFF-0000662 assigned as IO (Current Load: 0 cases)
ILOG-00001368,FIR-BLR-2021-00056,FIR_FILED,2021-04-09T18:00:00,OFF-0000506,FIR KA/BLR/2021/00056 registered at STN-KA-BLR-0052
ILOG-00001369,FIR-BLR-2021-00056,OFFICER_ASSIGNED,2021-04-09T21:00:00,OFF-0000508,Officer OFF-0000508 assigned as IO (Current Load: 0 cases)
ILOG-00001381,FIR-CTV-2021-00007,OFFICER_ASSIGNED,2021-04-10T05:00:00,,Officer None assigned as IO (Current Load: 0 cases)
ILOG-00001392,FIR-BLR-2021-00058,FIR_FILED,2021-04-10T08:00:00,OFF-0000202,FIR KA/BLR/2021/00058 registered at STN-KA-BLR-0020
ILOG-00001317,FIR-MYS-2021-00011,EVIDENCE_COLLECTED,2021-04-10T09:00:00,OFF-0000755,Evidence EVI-00000452 collected: CDR of accused mobile obtained from service provider
ILOG-00001393,FIR-BLR-2021-00058,OFFICER_ASSIGNED,2021-04-10T09:00:00,OFF-0000207,Officer OFF-0000207 assigned as IO (Current Load: 0 cases)
ILOG-00001385,FIR-BLR-2021-00057,FIR_FILED,2021-04-10T10:00:00,,FIR KA/BLR/2021/00057 registered at STN-KA-BLR-0002
ILOG-00001321,FIR-CTV-2021-00003,EVIDENCE_COLLECTED,2021-04-10T13:00:00,OFF-0003338,Evidence EVI-00000456 collected: Recovered vehicle from accused's possession
ILOG-00001365,FIR-CTV-2021-00006,EVIDENCE_COLLECTED,2021-04-10T13:00:00,OFF-0003372,Evidence EVI-00000460 collected: FASTag records showing vehicle movement
ILOG-00001371,FIR-BLR-2021-00056,EVIDENCE_COLLECTED,2021-04-10T13:00:00,OFF-0000505,Evidence EVI-00000466 collected: Voluntary statement of witness given
ILOG-00001396,FIR-BLR-2021-00058,EVIDENCE_COLLECTED,2021-04-10T13:00:00,OFF-0000205,Evidence EVI-00000475 collected: Stolen two-wheeler recovered
ILOG-00001397,FIR-RBG-2021-00031,FIR_FILED,2021-04-10T15:00:00,OFF-0003597,FIR KA/RBG/2021/00031 registered at STN-KA-RBG-0000
ILOG-00001386,FIR-BLR-2021-00057,OFFICER_ASSIGNED,2021-04-10T16:00:00,,Officer None assigned as IO (Current Load: 0 cases)
ILOG-00001398,FIR-RBG-2021-00031,OFFICER_ASSIGNED,2021-04-11T02:00:00,OFF-0003600,Officer OFF-0003600 assigned as IO (Current Load: 0 cases)
ILOG-00001292,FIR-BLR-2021-00050,EVIDENCE_COLLECTED,2021-04-11T09:00:00,OFF-0000049,Evidence EVI-00000442 collected: Hotel CCTV showing accused check-in
ILOG-00001293,FIR-BLR-2021-00050,EVIDENCE_COLLECTED,2021-04-11T09:00:00,OFF-0000050,Evidence EVI-00000443 collected: Seized iron rod used as weapon
ILOG-00001388,FIR-BLR-2021-00057,EVIDENCE_COLLECTED,2021-04-11T09:00:00,OFF-0000024,Evidence EVI-00000462 collected: Hotel CCTV showing accused check-in
ILOG-00001407,FIR-MYS-2021-00016,FIR_FILED,2021-04-11T09:00:00,OFF-0000662,FIR KA/MYS/2021/00016 registered at STN-KA-MYS-0001
ILOG-00000169,FIR-RBG-2021-00005,CHARGESHEET,2021-04-11T10:00:00,OFF-0003741,Chargesheet filed against 1 accused
ILOG-00001289,FIR-MYS-2021-00008,EVIDENCE_COLLECTED,2021-04-11T10:00:00,OFF-0000742,Evidence EVI-00000434 collected: SIM card seized
ILOG-00001288,FIR-MYS-2021-00008,EVIDENCE_COLLECTED,2021-04-11T11:00:00,OFF-0000743,Evidence EVI-00000441 collected: Bank account statement of accused showing proceeds
ILOG-00001302,FIR-CTV-2021-00002,EVIDENCE_COLLECTED,2021-04-11T12:00:00,OFF-0003315,Evidence EVI-00000447 collected: Recovered vehicle from accused's possession
ILOG-00001403,FIR-CTV-2021-00004,FIR_FILED,2021-04-11T12:00:00,,FIR KA/CTV/2021/00004 registered at STN-KA-CTV-0012
ILOG-00001415,FIR-BLR-2021-00059,FIR_FILED,2021-04-11T12:00:00,OFF-0000343,FIR KA/BLR/2021/00059 registered at STN-KA-BLR-0036
ILOG-00001410,FIR-MYS-2021-00017,FIR_FILED,2021-04-11T13:00:00,OFF-0000675,FIR KA/MYS/2021/00017 registered at STN-KA-MYS-0003
ILOG-00001061,FIR-BLR-2021-00048,ARREST,2021-04-11T14:00:00,OFF-0000175,"Accused Basavaraj Pillai arrested at Near Market, Bengaluru Urban"
ILOG-00001395,FIR-BLR-2021-00058,EVIDENCE_COLLECTED,2021-04-11T14:00:00,OFF-0000207,Evidence EVI-00000462 collected: Traffic camera footage of escape route
ILOG-00001401,FIR-RBG-2021-00031,EVIDENCE_COLLECTED,2021-04-11T15:00:00,OFF-0003597,Evidence EVI-00000478 collected: DNA analysis report
ILOG-00001248,FIR-HSN-2021-00002,ARREST,2021-04-11T16:00:00,OFF-0002336,"Accused Ramesh Shastri arrested at Near Highway, Hassan"
ILOG-00001337,FIR-BLR-2021-00054,EVIDENCE_COLLECTED,2021-04-11T16:00:00,OFF-0000173,Evidence EVI-00000458 collected: Hotel CCTV showing accused check-in
ILOG-00001049,FIR-BLRR-2021-00024,SUSPECT_IDENTIFIED,2021-04-12T00:00:00,OFF-0000608,Suspect Shruthi Rao identified through investigation
ILOG-00001416,FIR-BLR-2021-00059,OFFICER_ASSIGNED,2021-04-12T00:00:00,OFF-0000343,Officer OFF-0000343 assigned as IO (Current Load: 0 cases)
ILOG-00001408,FIR-MYS-2021-00016,OFFICER_ASSIGNED,2021-04-12T01:00:00,OFF-0000662,Officer OFF-0000662 assigned as IO (Current Load: 1 cases)
ILOG-00001411,FIR-MYS-2021-00017,OFFICER_ASSIGNED,2021-04-12T07:00:00,OFF-0000675,Officer OFF-0000675 assigned as IO (Current Load: 0 cases)
ILOG-00000921,FIR-MYS-2021-00002,CHARGESHEET,2021-04-12T10:00:00,OFF-0000696,Chargesheet filed against 1 accused
ILOG-00001326,FIR-BLR-2021-00053,EVIDENCE_COLLECTED,2021-04-12T10:00:00,OFF-0000135,Evidence EVI-00000455 collected: Hotel CCTV showing accused check-in
ILOG-00001421,FIR-MYS-2021-00018,FIR_FILED,2021-04-12T10:00:00,OFF-0000792,FIR KA/MYS/2021/00018 registered at STN-KA-MYS-0023
ILOG-00001425,FIR-MYS-2021-00018,EVIDENCE_COLLECTED,2021-04-12T10:00:00,OFF-0000791,Evidence EVI-00000474 collected: Laptop seized with fraud-related files
ILOG-00001404,FIR-CTV-2021-00004,OFFICER_ASSIGNED,2021-04-12T11:00:00,OFF-0003359,Officer OFF-0003359 assigned as IO (Current Load: 0 cases)
ILOG-00001422,FIR-MYS-2021-00018,OFFICER_ASSIGNED,2021-04-12T12:00:00,OFF-0000792,Officer OFF-0000792 assigned as IO (Current Load: 0 cases)
ILOG-00001378,FIR-MYS-2021-00015,EVIDENCE_COLLECTED,2021-04-12T13:00:00,OFF-0000662,Evidence EVI-00000469 collected: Call records linking accused to other suspects
ILOG-00001400,FIR-RBG-2021-00031,EVIDENCE_COLLECTED,2021-04-12T13:00:00,OFF-0003598,Evidence EVI-00000477 collected: Stolen cash recovered from accused
ILOG-00001412,FIR-MYS-2021-00017,EVIDENCE_COLLECTED,2021-04-12T14:00:00,OFF-0000673,Evidence EVI-00000480 collected: CDR of accused mobile obtained from service provider
ILOG-00001325,FIR-BLR-2021-00053,EVIDENCE_COLLECTED,2021-04-12T15:00:00,OFF-0000145,Evidence EVI-00000454 collected: Broken window glass collected from scene
ILOG-00001344,FIR-MYS-2021-00013,EVIDENCE_COLLECTED,2021-04-12T15:00:00,OFF-0000811,Evidence EVI-00000461 collected: CDR of accused mobile obtained from service provider
ILOG-00001353,FIR-BLR-2021-00055,EVIDENCE_COLLECTED,2021-04-12T15:00:00,OFF-0000022,Evidence EVI-00000462 collected: Shop CCTV footage showing accused vehicle
ILOG-00001331,FIR-MYS-2021-00012,EVIDENCE_COLLECTED,2021-04-12T16:00:00,OFF-0000693,Evidence EVI-00000457 collected: CDR of accused mobile obtained from service provider
ILOG-00001405,FIR-CTV-2021-00004,EVIDENCE_COLLECTED,2021-04-12T17:00:00,OFF-0003362,Evidence EVI-00000459 collected: Recovered vehicle from accused's possession
ILOG-00001362,FIR-MYS-2021-00014,ARREST,2021-04-12T21:00:00,OFF-0000701,"Accused Rohit Sharma arrested at Near Bus Stand, Mysuru"
ILOG-00001426,FIR-CTV-2021-00008,FIR_FILED,2021-04-13T08:00:00,OFF-0003318,FIR KA/CTV/2021/00008 registered at STN-KA-CTV-0004
ILOG-00001417,FIR-BLR-2021-00059,EVIDENCE_COLLECTED,2021-04-13T13:00:00,OFF-0000345,Evidence EVI-00000481 collected: Statement of auto driver who saw accused
ILOG-00001394,FIR-BLR-2021-00058,EVIDENCE_COLLECTED,2021-04-13T15:00:00,OFF-0000202,Evidence EVI-00000470 collected: Statement of eye witness recorded under Sec 161 CrPC
ILOG-00001433,FIR-BLR-2021-00060,EVIDENCE_COLLECTED,2021-04-13T15:00:00,OFF-0000436,Evidence EVI-00000486 collected: Country-made weapon seized
ILOG-00001402,FIR-RBG-2021-00031,EVIDENCE_COLLECTED,2021-04-13T17:00:00,OFF-0003602,Evidence EVI-00000479 collected: WhatsApp call records obtained
ILOG-00001430,FIR-BLR-2021-00060,FIR_FILED,2021-04-13T18:00:00,OFF-0000440,FIR KA/BLR/2021/00060 registered at STN-KA-BLR-0046
ILOG-00001435,FIR-BLR-2021-00061,FIR_FILED,2021-04-13T18:00:00,OFF-0000413,FIR KA/BLR/2021/00061 registered at STN-KA-BLR-0044
ILOG-00001050,FIR-BLRR-2021-00024,ARREST,2021-04-13T21:00:00,OFF-0000608,"Accused Shruthi Rao arrested at Near Bus Stand, Bengaluru Rural"
ILOG-00001436,FIR-BLR-2021-00061,OFFICER_ASSIGNED,2021-04-13T21:00:00,OFF-0000416,Officer OFF-0000416 assigned as IO (Current Load: 1 cases)
ILOG-00001339,FIR-BLR-2021-00054,SUSPECT_IDENTIFIED,2021-04-14T00:00:00,,Suspect Sangeetha Murthy identified through investigation
ILOG-00001427,FIR-CTV-2021-00008,OFFICER_ASSIGNED,2021-04-14T03:00:00,OFF-0003318,Officer OFF-0003318 assigned as IO (Current Load: 0 cases)
ILOG-00001439,FIR-UDR-2021-00022,FIR_FILED,2021-04-14T08:00:00,,FIR KA/UDR/2021/00022 registered at STN-KA-UDR-0013
ILOG-00001383,FIR-CTV-2021-00007,EVIDENCE_COLLECTED,2021-04-14T09:00:00,OFF-0003371,Evidence EVI-00000448 collected: Hotel CCTV showing accused check-in
ILOG-00001432,FIR-BLR-2021-00060,EVIDENCE_COLLECTED,2021-04-14T09:00:00,OFF-0000441,Evidence EVI-00000462 collected: Shop CCTV footage showing accused vehicle
ILOG-00000981,FIR-MGL-2021-00008,CHARGESHEET,2021-04-14T10:00:00,OFF-0000982,Chargesheet filed against 1 accused
ILOG-00001444,FIR-VKT-2021-00003,FIR_FILED,2021-04-14T10:00:00,,FIR KA/VKT/2021/00003 registered at STN-KA-VKT-0007
ILOG-00001446,FIR-VKT-2021-00003,EVIDENCE_COLLECTED,2021-04-14T10:00:00,OFF-0003241,Evidence EVI-00000489 collected: Recovered stolen gold jewellery
ILOG-00001440,FIR-UDR-2021-00022,OFFICER_ASSIGNED,2021-04-14T12:00:00,,Officer None assigned as IO (Current Load: 0 cases)
ILOG-00001447,FIR-BLR-2021-00062,FIR_FILED,2021-04-14T12:00:00,OFF-0000210,FIR KA/BLR/2021/00062 registered at STN-KA-BLR-0021
ILOG-00001399,FIR-RBG-2021-00031,EVIDENCE_COLLECTED,2021-04-14T14:00:00,OFF-0003603,Evidence EVI-00000476 collected: Voluntary statement of witness given
ILOG-00001431,FIR-BLR-2021-00060,OFFICER_ASSIGNED,2021-04-14T15:00:00,OFF-0000440,Officer OFF-0000440 assigned as IO (Current Load: 0 cases)
ILOG-00001451,FIR-BLR-2021-00063,FIR_FILED,2021-04-14T15:00:00,OFF-0000158,FIR KA/BLR/2021/00063 registered at STN-KA-BLR-0016
ILOG-00001448,FIR-BLR-2021-00062,OFFICER_ASSIGNED,2021-04-14T16:00:00,OFF-0000210,Officer OFF-0000210 assigned as IO (Current Load: 0 cases)
ILOG-00001355,FIR-BLR-2021-00055,SUSPECT_IDENTIFIED,2021-04-15T00:00:00,,Suspect Sangeetha Murthy identified through investigation
ILOG-00001390,FIR-BLR-2021-00057,SUSPECT_IDENTIFIED,2021-04-15T00:00:00,,Suspect Sangeetha Murthy identified through investigation
ILOG-00001445,FIR-VKT-2021-00003,OFFICER_ASSIGNED,2021-04-15T05:00:00,,Officer None assigned as IO (Current Load: 0 cases)
ILOG-00001452,FIR-BLR-2021-00063,OFFICER_ASSIGNED,2021-04-15T05:00:00,OFF-0000171,Officer OFF-0000171 assigned as IO (Current Load: 1 cases)
ILOG-00001382,FIR-CTV-2021-00007,EVIDENCE_COLLECTED,2021-04-15T09:00:00,OFF-0003370,Evidence EVI-00000472 collected: Recovered vehicle from accused's possession
ILOG-00001424,FIR-MYS-2021-00018,EVIDENCE_COLLECTED,2021-04-15T09:00:00,OFF-0000792,Evidence EVI-00000465 collected: Hawala transaction records
ILOG-00000713,FIR-BLR-2021-00026,CHARGESHEET,2021-04-15T10:00:00,OFF-0000100,Chargesheet filed against 1 accused
ILOG-00001389,FIR-BLR-2021-00057,EVIDENCE_COLLECTED,2021-04-15T10:00:00,OFF-0000020,Evidence EVI-00000471 collected: Broken window glass collected from scene
ILOG-00001437,FIR-BLR-2021-00061,EVIDENCE_COLLECTED,2021-04-15T12:00:00,OFF-0000426,Evidence EVI-00000487 collected: Voluntary statement of witness given
ILOG-00001442,FIR-UDR-2021-00022,EVIDENCE_COLLECTED,2021-04-15T12:00:00,OFF-0002537,Evidence EVI-00000483 collected: Statement of eye witness recorded under Sec 161 CrPC
ILOG-00001360,FIR-MYS-2021-00014,EVIDENCE_COLLECTED,2021-04-15T13:00:00,OFF-0000701,Evidence EVI-00000449 collected: SIM card seized
ILOG-00001370,FIR-BLR-2021-00056,EVIDENCE_COLLECTED,2021-04-15T14:00:00,OFF-0000509,Evidence EVI-00000462 collected: Hotel CCTV showing accused check-in
ILOG-00001450,FIR-BLR-2021-00062,EVIDENCE_COLLECTED,2021-04-15T16:00:00,OFF-0000225,Evidence EVI-00000491 collected: Country-made weapon seized
ILOG-00001459,FIR-BLR2-2021-00011,FIR_FILED,2021-04-15T16:00:00,,FIR KA/BLR2/2021/00011 registered at STN-KA-BLR2-0018
ILOG-00001455,FIR-BLR-2021-00063,EVIDENCE_COLLECTED,2021-04-15T17:00:00,OFF-0000160,Evidence EVI-00000494 collected: ATM withdrawal records from crime location
ILOG-00001456,FIR-BLG-2021-00009,FIR_FILED,2021-04-15T17:00:00,,FIR KA/BLG/2021/00009 registered at STN-KA-BLG-0003
ILOG-00001199,FIR-DVG-2021-00021,SUSPECT_IDENTIFIED,2021-04-16T00:00:00,OFF-0001740,Suspect Nagaraj Lingayat identified through investigation
ILOG-00001460,FIR-BLR2-2021-00011,OFFICER_ASSIGNED,2021-04-16T06:00:00,,Officer None assigned as IO (Current Load: 0 cases)
ILOG-00001463,FIR-UDR-2021-00023,FIR_FILED,2021-04-16T08:00:00,,FIR KA/UDR/2021/00023 registered at STN-KA-UDR-0004
ILOG-00001480,FIR-UDR-2021-00024,EVIDENCE_COLLECTED,2021-04-16T09:00:00,OFF-0002445,Evidence EVI-00000504 collected: CCTV footage from nearby bank ATM showing accused
ILOG-00001457,FIR-BLG-2021-00009,OFFICER_ASSIGNED,2021-04-16T10:00:00,,Officer None assigned as IO (Current Load: 0 cases)
ILOG-00001469,FIR-BLR-2021-00064,FIR_FILED,2021-04-16T10:00:00,OFF-0000121,FIR KA/BLR/2021/00064 registered at STN-KA-BLR-0011
ILOG-00001372,FIR-BLR-2021-00056,EVIDENCE_COLLECTED,2021-04-16T11:00:00,OFF-0000497,Evidence EVI-00000467 collected: Broken window glass collected from scene
ILOG-00001379,FIR-MYS-2021-00015,EVIDENCE_COLLECTED,2021-04-16T13:00:00,OFF-0000663,Evidence EVI-00000449 collected: SIM card seized
ILOG-00001478,FIR-UDR-2021-00024,FIR_FILED,2021-04-16T13:00:00,OFF-0002448,FIR KA/UDR/2021/00024 registered at STN-KA-UDR-0000
ILOG-00001377,FIR-MYS-2021-00015,EVIDENCE_COLLECTED,2021-04-16T14:00:00,OFF-0000661,Evidence EVI-00000465 collected: Bank account statement of accused showing proceeds
ILOG-00001387,FIR-BLR-2021-00057,EVIDENCE_COLLECTED,2021-04-16T14:00:00,OFF-0000024,Evidence EVI-00000470 collected: Statement of shop keeper recorded
ILOG-00001406,FIR-CTV-2021-00004,EVIDENCE_COLLECTED,2021-04-16T14:00:00,OFF-0003361,Evidence EVI-00000460 collected: FASTag records showing vehicle movement
ILOG-00001479,FIR-UDR-2021-00024,OFFICER_ASSIGNED,2021-04-16T14:00:00,OFF-0002448,Officer OFF-0002448 assigned as IO (Current Load: 2 cases)
ILOG-00001441,FIR-UDR-2021-00022,EVIDENCE_COLLECTED,2021-04-16T15:00:00,OFF-0002536,Evidence EVI-00000482 collected: Fingerprints lifted from crime scene matched with accused
ILOG-00001464,FIR-UDR-2021-00023,OFFICER_ASSIGNED,2021-04-16T15:00:00,OFF-0002473,Officer OFF-0002473 assigned as IO (Current Load: 1 cases)
ILOG-00001332,FIR-MYS-2021-00012,SUSPECT_IDENTIFIED,2021-04-17T00:00:00,,Suspect Rohit Sharma identified through investigation
ILOG-00001470,FIR-BLR-2021-00064,OFFICER_ASSIGNED,2021-04-17T06:00:00,OFF-0000119,Officer OFF-0000119 assigned as IO (Current Load: 0 cases)
ILOG-00001467,FIR-UDR-2021-00023,EVIDENCE_COLLECTED,2021-04-17T09:00:00,OFF-0002474,Evidence EVI-00000482 collected: Latent fingerprints developed using powder technique
ILOG-00001462,FIR-BLR2-2021-00011,EVIDENCE_COLLECTED,2021-04-17T11:00:00,OFF-0003506,Evidence EVI-00000498 collected: Neighbour's statement recorded
ILOG-00001391,FIR-BLR-2021-00057,ARREST,2021-04-17T13:00:00,OFF-0000024,"Accused Sangeetha Murthy arrested at Near Highway, Bengaluru Urban"
ILOG-00001485,FIR-VKT-2021-00004,FIR_FILED,2021-04-17T13:00:00,,FIR KA/VKT/2021/00004 registered at STN-KA-VKT-0007
ILOG-00001340,FIR-BLR-2021-00054,ARREST,2021-04-17T20:00:00,OFF-0000173,"Accused Sangeetha Murthy arrested at Near Highway, Bengaluru Urban"
ILOG-00001486,FIR-VKT-2021-00004,OFFICER_ASSIGNED,2021-04-17T23:00:00,,Officer None assigned as IO (Current Load: 0 cases)
ILOG-00001487,FIR-VKT-2021-00004,EVIDENCE_COLLECTED,2021-04-18T10:00:00,OFF-0003243,Evidence EVI-00000508 collected: Neighbour's statement recorded
ILOG-00001449,FIR-BLR-2021-00062,EVIDENCE_COLLECTED,2021-04-18T11:00:00,OFF-0000211,Evidence EVI-00000490 collected: Traffic camera footage of escape route
ILOG-00001429,FIR-CTV-2021-00008,EVIDENCE_COLLECTED,2021-04-18T12:00:00,OFF-0003320,Evidence EVI-00000448 collected: CCTV footage from nearby bank ATM showing accused
ILOG-00001461,FIR-BLR2-2021-00011,EVIDENCE_COLLECTED,2021-04-18T12:00:00,OFF-0003506,Evidence EVI-00000497 collected: Hotel CCTV showing accused check-in
ILOG-00001493,FIR-UDR-2021-00026,EVIDENCE_COLLECTED,2021-04-18T12:00:00,OFF-0002635,Evidence EVI-00000513 collected: Market CCTV footage retrieved
ILOG-00001496,FIR-MYS-2021-00019,FIR_FILED,2021-04-18T12:00:00,OFF-0000697,FIR KA/MYS/2021/00019 registered at STN-KA-MYS-0008
ILOG-00001490,FIR-UDR-2021-00026,FIR_FILED,2021-04-18T13:00:00,OFF-0002624,FIR KA/UDR/2021/00026 registered at STN-KA-UDR-0025
ILOG-00001409,FIR-MYS-2021-00016,EVIDENCE_COLLECTED,2021-04-18T15:00:00,OFF-0000661,Evidence EVI-00000474 collected: Mobile phone seized containing incriminating photos
ILOG-00001497,FIR-MYS-2021-00019,OFFICER_ASSIGNED,2021-04-18T21:00:00,OFF-0000697,Officer OFF-0000697 assigned as IO (Current Load: 1 cases)
ILOG-00001476,FIR-BLR-2021-00064,SUSPECT_IDENTIFIED,2021-04-19T00:00:00,OFF-0000119,Suspect Priya Vokkaliga identified through investigation
ILOG-00001491,FIR-UDR-2021-00026,OFFICER_ASSIGNED,2021-04-19T02:00:00,OFF-0002635,Officer OFF-0002635 assigned as IO (Current Load: 1 cases)
ILOG-00001356,FIR-BLR-2021-00055,ARREST,2021-04-19T07:00:00,OFF-0000020,"Accused Sangeetha Murthy arrested at Near Bus Stand, Bengaluru Urban"
ILOG-00001472,FIR-BLR-2021-00064,EVIDENCE_COLLECTED,2021-04-19T09:00:00,OFF-0000119,Evidence EVI-00000500 collected: Country-made weapon seized
ILOG-00001504,FIR-BLR2-2021-00012,FIR_FILED,2021-04-19T10:00:00,,FIR KA/BLR2/2021/00012 registered at STN-KA-BLR2-0004
ILOG-00001512,FIR-KDG-2021-00002,EVIDENCE_COLLECTED,2021-04-19T10:00:00,OFF-0002431,Evidence EVI-00000524 collected: Hotel CCTV showing accused check-in
ILOG-00001423,FIR-MYS-2021-00018,EVIDENCE_COLLECTED,2021-04-19T11:00:00,OFF-0000791,Evidence EVI-00000485 collected: WhatsApp call records obtained
ILOG-00001454,FIR-BLR-2021-00063,EVIDENCE_COLLECTED,2021-04-19T11:00:00,OFF-0000165,Evidence EVI-00000493 collected: Statement of auto driver who saw accused
ILOG-00001482,FIR-UDR-2021-00024,EVIDENCE_COLLECTED,2021-04-19T11:00:00,OFF-0002447,Evidence EVI-00000506 collected: Statement of shop keeper recorded
ILOG-00001501,FIR-UDR-2021-00025,FIR_FILED,2021-04-19T11:00:00,,FIR KA/UDR/2021/00025 registered at STN-KA-UDR-0001
ILOG-00001510,FIR-KDG-2021-00002,FIR_FILED,2021-04-19T11:00:00,,FIR KA/KDG/2021/00002 registered at STN-KA-KDG-0006
ILOG-00001505,FIR-BLR2-2021-00012,OFFICER_ASSIGNED,2021-04-19T13:00:00,OFF-0003412,Officer OFF-0003412 assigned as IO (Current Load: 0 cases)
ILOG-00001438,FIR-BLR-2021-00061,EVIDENCE_COLLECTED,2021-04-19T15:00:00,OFF-0000417,Evidence EVI-00000462 collected: Hotel CCTV showing accused check-in
ILOG-00001471,FIR-BLR-2021-00064,EVIDENCE_COLLECTED,2021-04-19T15:00:00,OFF-0000121,Evidence EVI-00000499 collected: Statement of auto driver who saw accused
ILOG-00001453,FIR-BLR-2021-00063,EVIDENCE_COLLECTED,2021-04-19T16:00:00,OFF-0000172,Evidence EVI-00000492 collected: Tower location data obtained for accused phone
ILOG-00001499,FIR-MYS-2021-00019,EVIDENCE_COLLECTED,2021-04-19T16:00:00,OFF-0000697,Evidence EVI-00000519 collected: Neighbour's statement recorded
ILOG-00001509,FIR-BLR2-2021-00012,EVIDENCE_COLLECTED,2021-04-19T16:00:00,OFF-0003410,Evidence EVI-00000517 collected: ATM withdrawal records from crime location
ILOG-00001200,FIR-DVG-2021-00021,ARREST,2021-04-19T17:00:00,OFF-0001743,"Accused Nagaraj Lingayat arrested at Near Market, Davanagere"
